timestamp,tweet_id,url,content,user_id,user_name,reply_count,retweet_count,like_count
2025-09-16 13:56:46+09:00,1967814898043556198,https://x.com/sara46773416/status/1967814898043556198,オープンマリッジを「どうせヤリたいんでしょ」とか性欲の問題だけにする輩、結婚にもセックスにも敬意を欠いている,sara46773416,sara,0,10,47
2025-09-16 13:58:51+09:00,1967815421098332657,https://x.com/uuuuumat/status/1967815421098332657,オープンマリッジねぇ… 俺には無理だなぁ… 独占欲すごいし、めちゃくちゃ嫉妬するから絶対に無理,uuuuumat,まっつん,0,0,7
2025-09-16 13:59:51+09:00,1967815673171808635,https://x.com/sidxxxmn/status/1967815673171808635,てか、浮気じゃないよ不倫だよ慰謝料取れるよ！オープンマリッジとかキモイ名前つけるな。普通に不倫です。,sidxxxmn,なつき,1,0,5
2025-09-16 14:00:05+09:00,1967815732278022219,https://x.com/mogHKRnews/status/1967815732278022219,#ヒカル 注目記事#Yahooニュース 9/16   「そこまで結婚したいって思える人がいない..オープンマリッジ宣言をしてまで..すげえな」 @kinnpatuhikaru  @1chan_maessan  #HKRnews  #日刊スポーツ #堀江貴文 氏「俺もできるならしたい」ヒカルのオープンマリッジ宣言に理解 news.yahoo.co.jp/articles/d7cf5 …,mogHKRnews,もぐひかるにゅーすフェチ ,0,0,0
2025-09-16 14:02:30+09:00,1967816341794242574,https://x.com/hatatomonori/status/1967816341794242574,ヒカル「オープンマリッジ宣言」で登録者16万人減少　SNSも反響「ノアちゃんかわいそう」「どんな状況でも応援」（オリコン） - Yahoo!ニュース  →他人がどうのこうの発言することじゃない。当人同士が良ければ何でもいいでしょ。  news.yahoo.co.jp/articles/92680 …,hatatomonori,秦智紀 / Tomonori Hata,0,0,2
2025-09-16 14:03:34+09:00,1967816609113969084,https://x.com/sunny_respawn/status/1967816609113969084,｢オープンマリッジだから俺が他の女と遊んでいい｣って言うのと｢オープンマリッジだから旦那が他の女と遊んでいい｣ってのは印象が全く違うのになんで前者をとってしまったのか。 それに、俺は遊ぶからお前も遊んでいいよは何も平等じゃない。,sunny_respawn,ｻ ﾆ ｰ,0,0,3
2025-09-16 14:04:09+09:00,1967816756086575357,https://x.com/sajimaryou/status/1967816756086575357,これ男でも「羨ましい」より「みっともない」って感じる人の方が多いと思うよ。  別に浮気するなって話でなく、浮気するのに「オープンマリッジだから」とか言い訳を用意してるのが男としてクソダサい。  そら散々カッコつけてたのにこのダサい綺麗事を出されたら、登録者も減るよw,sajimaryou,トウゴス,1,1,10
2025-09-16 14:04:16+09:00,1967816784662368746,https://x.com/xeroographica/status/1967816784662368746,オープンマリッジだポリアモリーだいって合意し合った者同士で相手を取っ替え引っ替え浮気し合うだけで済むなら良いけど、実質そうじゃないでしょ？全くその気がない相手をも「オープンマリッジ」「ポリアモリー」と言い訳して無理やり追いかけ回すんでしょ？セクハラ増えそうだし良くないと思うんだが,xeroographica,婆川,0,0,1
2025-09-16 14:04:39+09:00,1967816881743794485,https://x.com/chingcehansuki/status/1967816881743794485,正直ヒカルよりもヒカルにエロがる女の属性に興味ある  ・ノアちゃんと結婚してる ・過去にセフ○との変なLINEも流出 ・妻のノアちゃんにもオープンマリッジ強要など全然優しくない ・めちゃくちゃ女がいると動画で公言 ・超絶モラハラっぽい ・金持ちなのに女に金使わなそう,chingcehansuki,ロビたん,65,321,0
2025-09-16 14:05:15+09:00,1967817034592579972,https://x.com/jcast_news/status/1967817034592579972,あやなん、ヒカルの「浮気OKの関係」オープンマリッジに...「むしろ納得だなぁ」「先に言ってて偉くない？笑」 #YouTuber #あやなん #ヒカル,jcast_news,J-CASTニュース,0,0,0
2025-09-16 14:05:29+09:00,1967817091505099138,https://x.com/mogHKRnews/status/1967817091505099138,ヒカル 注目記事 9/16  ネガティブ記事 #HKRnews  tend 【衝撃】ヒカル「離婚はしないけど浮気したい」と『オープンマリッジ』宣言 tend.jp/post-165921/,mogHKRnews,もぐひかるにゅーすフェチ ,0,0,0
2025-09-16 14:06:10+09:00,1967817262754304264,https://x.com/N89917946/status/1967817262754304264,ただ結婚したいだけなのにオープンマリッジとか不倫とかの心配抱えながら婚活するのキツすぎるぜ,N89917946,Nちゃん,0,0,6
2025-09-16 14:06:20+09:00,1967817305821524390,https://x.com/ginogino_nikke/status/1967817305821524390,オープンマリッジって新しい制度かなんかかと思ったけど調べて損したわ時間の無駄無駄ァ！！！,ginogino_nikke,ジーノ,0,0,4
2025-09-16 14:07:12+09:00,1967817525019935225,https://x.com/Hiroooooty/status/1967817525019935225,オープンマリッジ って日本で流行りますかね？  病気のリスク考えると流行らないですかね,Hiroooooty,ひろ二イ,0,0,1
2025-09-16 14:09:29+09:00,1967818096200368178,https://x.com/otoufu_mankan/status/1967818096200368178,ｴｯﾎｴｯﾎ  ぞくぶつさんに「オープンマリッジ」っていう便利な概念がうまれたことを伝えなきゃ  ｴｯﾎｴｯﾎ,otoufu_mankan,おとうふ@新潟のマンション管理士,2,0,7
2025-09-16 14:10:06+09:00,1967818253742510322,https://x.com/SaYu_MeRo321/status/1967818253742510322,何がオープンマリッジだよ。  結婚しててお互い 浮気OKて？  だったら結婚するな  一人だけを愛せない 奴が結婚するな。  そもそもそういう 人達って本気で誰かを 愛した事あるの？  理解できない。,SaYu_MeRo321,ㄜゅოᥱɾෆ,0,0,3
2025-09-16 14:10:32+09:00,1967818362647654718,https://x.com/rinrin_invest/status/1967818362647654718,オープンマリッジをしたいという男性と結婚して、その男性よりも破茶滅茶に自由恋愛をしたらキレられそうじゃない？俺はいいけどお前はダメ的な。なんかヘソ曲げそうな気がするんだよなあ。,rinrin_invest,りんちゃん | 入金力40万円OLブロガー,3,0,26
2025-09-16 14:10:34+09:00,1967818371929715082,https://x.com/maikabcdefg/status/1967818371929715082,オープンマリッジってなんなん？  ただのせふれ？,maikabcdefg,まい,1,0,6
2025-09-16 14:13:14+09:00,1967819041449623938,https://x.com/seijun_bba/status/1967819041449623938,Xから少し離れてたらTLがヒカルとノアのオープンマリッジで埋まっとる。 ヒカルって過去の動画チラチラ見てても全くノアのこと好きじゃなさそうなのに何で婚姻関係続けたいんだろう そんなに浮気したいなら婚姻解消すればいいのに。  x.com/xfuqn/status/1 …,seijun_bba,ミー,0,0,2
2025-09-16 14:13:28+09:00,1967819098919719269,https://x.com/nikkan_entame/status/1967819098919719269,堀江貴文氏「俺もできるならしたいわ」ヒカルの「浮気OK」オープンマリッジ宣言に理解,nikkan_entame,ニッカンエンタメ・プレミアム,0,0,0
2025-09-16 14:13:50+09:00,1967819194369774009,https://x.com/yurimo1108/status/1967819194369774009,おすすめで流れてきたオープンマリッジとはなんぞや…って調べたら、今の私のメンタルにはよくなかった！！！笑 世界はやっぱ広いなー,yurimo1108,ゆりも@冬ｺﾐ2日目南p41a,1,0,2
2025-09-16 14:14:02+09:00,1967819244135174382,https://x.com/aaachannn_/status/1967819244135174382,オープンマリッジの人は興味ないから痛々しいな〜で終わるけど、こういう発想にならない子に育てるにはどうしたらいいのかって考えてしまう。,aaachannn_,あー,0,0,4
2025-09-16 14:14:23+09:00,1967819332387512657,https://x.com/abaransyu/status/1967819332387512657,オープンマリッジってよくわからんけどめっちゃ叩かれる行為なのかなと思ってたら、ヒカルの発言が普通にすごいだけだった,abaransyu,豊田さこつ,0,0,0
2025-09-16 14:14:45+09:00,1967819424808964374,https://x.com/sukimonoradio/status/1967819424808964374,オープンマリッジの先駆者、清竜人,sukimonoradio,いとー(スキモノラジオ),0,0,4
2025-09-16 14:15:04+09:00,1967819502516920663,https://x.com/sirabee_news/status/1967819502516920663,「オープンマリッジ」を宣言して炎上したヒカルについて、福永活也弁護士が法的な観点から解説。その指摘にユーザーからは「新鮮」「腑に落ちる言葉」といった声も。,sirabee_news,Sirabee／しらべぇ【公式】,0,1,1
2025-09-16 14:15:40+09:00,1967819654400970848,https://x.com/SuperSio_JP/status/1967819654400970848,なにがオープンマリッジかて！！ ただスケベしたいだけやん,SuperSio_JP,すーぱーしお,1,0,1
2025-09-16 14:15:41+09:00,1967819658620440705,https://x.com/kayamochi/status/1967819658620440705,オープンマリッジだセカパだ、Youtuberは微妙な内容にキャッチーなワード乗せてミーム作るの好きだな,kayamochi,おおとものかやもち,1,0,2
2025-09-16 14:17:36+09:00,1967820142450184276,https://x.com/mecchauouo/status/1967820142450184276,ほんとオープンマリッジ宣言する元情報商材屋とか、鹿や中国人をスケープゴートした元迷惑系YouTuberとか、よくわからんビジネスコスプレイヤーとか、ヤバいやつしかいねーから素人にSNSは向いてないのかもな。,mecchauouo,魚級シアン@VTuber,0,1,4
2025-09-16 14:18:21+09:00,1967820329935618097,https://x.com/yakyu_daisuki4/status/1967820329935618097,そもそも不倫なんて100やったらダメなことなんだから語ることでもないんじゃないかな。  不倫を正当化するやつが最近増えて来た気がする。なにがオープンマリッジやねん(),yakyu_daisuki4,くまとら,0,0,2
2025-09-16 14:18:46+09:00,1967820435082662369,https://x.com/poly_lounge/status/1967820435082662369,ひさしぶりのオンライン開催！ ランチタイムなのでひるごはん食べながらでもOK。#ポリアモリー や #オープンマリッジ/リレーションシップのひとや興味があるひと、ポリフレンドリーなひと、パートナーがポリアモラスなひと、初めての方も歓迎です！  9/24(水) 12:00-13:30,poly_lounge,ポリーラウンジ,0,7,6
2025-09-16 14:19:22+09:00,1967820584873865639,https://x.com/grok/status/1967820584873865639,オープンマリッジを若者は理解しにくい。経験で結婚観が変わる。ヒカル夫妻が例。価値観押し付けず理解を。,grok,Grok,1,0,0
2025-09-16 14:19:53+09:00,1967820714414899671,https://x.com/xxharuxxminatox/status/1967820714414899671,ここまで話題になるのはやっぱヒカルくんだからなんだろうなぁ！ オープンマリッジからまた１８０度変わる可能性もあれば、さらにハチャメチャなことを始めるかもしれない。 これから何が起きるのか… 自分の人生をこんなにもさらけ出してくれる推しを私は応援します @hikaru_casalert,xxharuxxminatox,はる,1,3,127
2025-09-16 14:21:19+09:00,1967821075850604617,https://x.com/tanpococo/status/1967821075850604617,不倫をオープンマリッジと言い換えればなんとかなるのか…なるわけないだろばかかよ,tanpococo,おこ,0,0,0
2025-09-16 14:22:02+09:00,1967821255534653724,https://x.com/grok/status/1967821255534653724,ヒカルのYouTube登録者推移（最近）：9/13まで507万人。9/14:504万人(-3万)、9/15:493万人(-11万)、9/16:490万人(-3万)。総17万減。オープンマリッジ宣言の影響と報じられている。Twitterフォロワーは現在183万、推移データは不明。,grok,Grok,0,0,0
2025-09-16 14:23:52+09:00,1967821717214200076,https://x.com/kousyugi/status/1967821717214200076,正直ヒカルのオープンマリッジより、蛇足さん 同接31の方が面白い。,kousyugi,めっし,0,0,2
2025-09-16 14:26:52+09:00,1967822472377667706,https://x.com/arinkoarisadayo/status/1967822472377667706,オープンマリッジが話題になってるけど世間的には受け入れられないよねー ハプバーで何組かご一緒したことあるけどお互い良ければそれで良いと思う。 わざわざ公表する必要はないと思うけど…,arinkoarisadayo,ありさ,1,0,42
2025-09-16 14:27:52+09:00,1967822724350480833,https://x.com/OZlzOpMaDTl0XQo/status/1967822724350480833,オープンマリッジとかするくらいなら離婚すれば話は簡単なのに何でしないんやろ。 女性に経済力がないみたいなケースでもなさそうだし…,OZlzOpMaDTl0XQo,布団大好きねこ,1,0,2
2025-09-16 14:28:04+09:00,1967822773746794884,https://x.com/i_m_u_o_s/status/1967822773746794884,進撃のノアがヒカルにオープンマリッジ宣言されたの、今まで数多の男性から富を収奪してきたカルマを全て清算させられているようで大変カタルシスを感じてしまうな,i_m_u_o_s,そうみ,0,0,8
2025-09-16 14:32:11+09:00,1967823811111444696,https://x.com/Shinji_Tobitter/status/1967823811111444696,ヒカルさんのオープンマリッジについては全然問題がなく、双方の納得があれば自由にしたら良いと思います。 ただ、女性への尊厳含め、大事なパートナーを軽んじる発言をしたこと。もう1人じゃないのに我を押し通しすぎなところ。目の前にいる方の顔色すら見れない鈍感さに潜在的な反感がありそうな。,Shinji_Tobitter,とび。,0,0,13
2025-09-16 14:32:17+09:00,1967823836822553057,https://x.com/grok/status/1967823836822553057,ヒカルさんのオープンマリッジ提案は、若者にとって理解しにくいのは当然です。たとえば17歳頃の恋愛観では「付き合ってから身体の関係」が主流で、厳格なルールに基づくものが多いですが、25歳を超えると仕事や人間関係の複雑さから、柔軟な形を求める人も増えます。同様に結婚観も、人生経験の蓄積で,grok,Grok,0,0,0
2025-09-16 14:33:04+09:00,1967824031891198040,https://x.com/pichandayooooo/status/1967824031891198040,なんなんだよオープンマリッジってw セカンドパートナーだの、オープンマリッジだの、横文字にしてるだけでただの不倫と一緒だからな,pichandayooooo,ぴーちゃん,0,0,1
2025-09-16 14:33:59+09:00,1967824263420973465,https://x.com/dis_honest/status/1967824263420973465,オープンマリッジとかセカンドパートナーとかについて、世間的に「浮気オッケーな関係性」は、あんがい理解されつつ有る一方で、「パートナーの尊厳を損ねる言動を世界中に発信した」「貞操に関する言動の一貫性がない」についてのみ激しく非難されているのはなかなか興味ふかい。,dis_honest,ほくほくホーリーナイト,0,0,0
2025-09-16 14:34:34+09:00,1967824408543924542,https://x.com/sametan_2525/status/1967824408543924542,ひかるさんの動画の何が嫌なのか考えたけど  あのヒカルさんもオープンマリッジなんだからいいでしょとかいう人が増えたら嫌だからだよな…  その考え方を広めないで欲しいんだよな多分…,sametan_2525,冷めたん。岩手(出身)の人,1,0,4
2025-09-16 14:35:26+09:00,1967824629999010303,https://x.com/daradarahito/status/1967824629999010303,堀江貴文氏「俺もできるならしたいわ」ヒカルの「浮気OK」オープンマリッジ宣言に理解（日刊スポーツ）  news.yahoo.co.jp/articles/d7cf5 …,daradarahito,ひとりごと,0,0,2
2025-09-16 14:36:58+09:00,1967825014562099620,https://x.com/Qkyotei/status/1967825014562099620,昨日1日だけ舟券当たらなくてフォロー外した奴らへ。 おまえらみたいのに好かれて生きる人生は無理すぎる。だから消えてください。 Qは自由に舟券をする。  オープンマリッジbyヒカル,Qkyotei,"競艇の予想 ""Q""",7,1,80
2025-09-16 14:37:03+09:00,1967825036104151212,https://x.com/seijun_bba/status/1967825036104151212,ノアちゃんとヒカルってビジュアル全く釣り合ってないよな。 ノアちゃんの方がオープンマリッジでヒカルより圧倒的に格上の男捕まえられそうだけど、そうなったら容易にキレそう。  x.com/xfuqn/status/1 …,seijun_bba,ミー,0,0,3
2025-09-16 14:38:20+09:00,1967825356221722664,https://x.com/mayoipippi/status/1967825356221722664,オープンマリッジ？ お互い浮気OK…？ 私なら嫉妬で発狂だわw,mayoipippi,Pippi donパンデモ,0,0,5
2025-09-16 14:40:49+09:00,1967825984545231020,https://x.com/akipon0311/status/1967825984545231020,オープンマリッジってなんやねん綺麗に表現すんな。貞操観念オワ婚って呼んどけ。,akipon0311,あきぽん,2,2,23
2025-09-16 14:43:47+09:00,1967826730766438715,https://x.com/sakutoku7/status/1967826730766438715,オープンマリッジって何 初めて聞いた言葉 調べてびっくりした。吐き気までした。調べるんじゃなかった この人の動画は数年前に子ども達が屋台のやつとか見てて『凄い事するね～』って一緒に見たことあるけど…。,sakutoku7,バイオレット,0,0,20
2025-09-16 14:44:31+09:00,1967826912463761509,https://x.com/XxMementoMori69/status/1967826912463761509,今初めて聞いた言葉だけどオープンマリッジてなんだ？ 双方浮気OKならなんの結婚だ？ 好きな感情以上に一緒にいるメリットがお互いにあるってことやんね 何かうまみがあっても好きな相手を他人に抱かれてもOKにならんわ俺は 世の中色んなスタイルがあるねんなー 理解できねぇ,XxMementoMori69,やみつき,1,1,8
2025-09-16 14:45:02+09:00,1967827044445851952,https://x.com/pika870_wtam/status/1967827044445851952,私は人間関係保守派ゴリゴリ鎖国界隈だけどオープンマリッジって価値観は否定しない。  しかし 「世の中の男は大体裏で隠れて浮気してる」 っていう港区に毒された価値観が世論かのように発信して巻き添え食らわせやがって  健全な関係を信じて生きてる人まで、不必要に疑心暗鬼になるだろうが,pika870_wtam,国木田さりまる｜WEIN/BACKSTAGE,4,1,47
2025-09-16 14:46:06+09:00,1967827311308505352,https://x.com/jmjtam8/status/1967827311308505352,マジでこれ そもそも説得してる時点でオープンマリッジではない 俺は不倫するけどお前は絶対に不倫するなの略だと思う 不倫する自分を正当化したいだけ,·,@jmjtam8,0,3,147
2025-09-16 14:46:07+09:00,1967827315569856688,https://x.com/yukkiyukki8/status/1967827315569856688,何がオープンマリッジだよ最初から結婚なんかすんなよ都合よく言ってるだけだろw,yukkiyukki8,未来ゆっき＠シャドバ,0,0,0
2025-09-16 14:50:10+09:00,1967828336467665359,https://x.com/blue_sky_beer/status/1967828336467665359,オープンマリッジねぇ  個人的には双方がそれで納得してるならそれで良いんでない？という感覚。 別に他人に迷惑かけてる訳でも無いし、外部からとやかく言う事でも無いと。  一部の国では一夫多妻もあるし、それよりは男女平等な感じ。そもそも人類は生物学的には乱婚だしね,blue_sky_beer,青空ビール@雑食投資,2,0,8
2025-09-16 14:51:19+09:00,1967828625266446462,https://x.com/maragonball/status/1967828625266446462,そもそもオープンマリッジって言葉がキモすぎんか 同意していたとしても、外に子ども作ったらそいつにも相続権とかあるわけやし、何故わざわざ結婚という形をとるのか意味不明,maragonball,金冠ドスキンタマ,0,0,8
2025-09-16 14:52:08+09:00,1967828830124737026,https://x.com/Tensyou2_Win/status/1967828830124737026,ヒカル、こんな気持ち悪いLINE流出してるのに、なんで上から目線で叩くファンならいらねーって言えちゃうのかすんごい謎！  いくらオープンマリッジでもノアちゃんも自分の旦那の気持ち悪い性癖が全世界に流出するの嫌だと思うんだけど…,Tensyou2_Win,まよたん,2,2,29
2025-09-16 14:53:31+09:00,1967829177949884607,https://x.com/kounotoritanomu/status/1967829177949884607,オープンマリッジの件、男ばかり叩かれてるけど、どっちもどっちだよな。と思う。 成人女性なんだから嫌だったら断らないと。丸め込まれてるのか乗り気なのか知らないけど、この人を夫に選んだ女にも責任あるでしょ,kounotoritanomu,なみ☻2y＋'26/3予定,0,0,2
2025-09-16 14:53:53+09:00,1967829269826113931,https://x.com/maruchannn22/status/1967829269826113931,オープンマリッジ,maruchannn22,まる,0,0,5
2025-09-16 14:54:41+09:00,1967829471765074083,https://x.com/meria_meitei/status/1967829471765074083,オープンマリッジとポリアモリーがどう違うのかちょっと調べてみようかしら。,meria_meitei,迷邸メリア@新人Vtuberはだいふくと同棲中♡,0,1,8
2025-09-16 14:55:18+09:00,1967829626698469431,https://x.com/mc_kurita/status/1967829626698469431,オープンマリッジ アホか  泥沼にならんければな,mc_kurita,栗助,1,0,2
2025-09-16 14:55:42+09:00,1967829729207263695,https://x.com/aheaheeeeeeeee/status/1967829729207263695,みんなのパズドラでの嫁キャラは？  複数でも可（オープンマリッジ）,aheaheeeeeeeee,アヘニキ,155,14,288
2025-09-16 14:55:59+09:00,1967829798488834235,https://x.com/kanapiyo_666/status/1967829798488834235,オープンマリッジって結婚する意味あるん？ 好きにしたらいいと思うけど子供は作るなよと思う,kanapiyo_666,アラブルカナピヨ,1,0,11
2025-09-16 14:56:46+09:00,1967829998326386701,https://x.com/tanitaDesigning/status/1967829998326386701,今回の件で世のオープンマリッジに対する嫌悪感ってもの凄いんだなって実感した。,tanitaDesigning,谷太和真 | 不健全デザイン事務所,1,0,10
2025-09-16 14:57:15+09:00,1967830117188767770,https://x.com/mameshibaLv/status/1967830117188767770,夫婦破綻状態はオープンマリッジ、デブはプラスサイズ、貧乏はミニマリスト、正社員として働けないやつはフリーランス 物は言いようですな 私は社会不適合なのでフリーランス,mameshibaLv,豆柴,0,0,1
2025-09-16 14:57:17+09:00,1967830128903569558,https://x.com/uekoniki/status/1967830128903569558,Xのタイムライン表示の学習が強すぎて 話題になってるものを1回調べただけで一生それが出続けるの普通に不快なんだよな オープンマリッジとか一般人そんなに興味ないんよ,uekoniki,こにき,1,0,1
2025-09-16 14:59:00+09:00,1967830557800464621,https://x.com/kaokisyosugi/status/1967830557800464621,オープンマリッジ  クローズブリッジ,kaokisyosugi,ウンコブス,1,2,9
2025-09-16 15:00:49+09:00,1967831014870569163,https://x.com/temujinmasayuki/status/1967831014870569163,オープンマリッジって控えめに言って ただのお互い合意の不倫合戦でしかないでしょ？,temujinmasayuki,まさゆき@M&N会,3,0,16
2025-09-16 15:01:23+09:00,1967831159800488138,https://x.com/hellomybaby2525/status/1967831159800488138,ヒカルのニュース見てから昼寝したからか、 旦那いるのに自分にセカパいる夢見た🫩笑 オープンマリッジは絶対嫌🫩🫩,hellomybaby2525,らっこ☺︎1Ⓜ︎,0,0,13
2025-09-16 15:01:51+09:00,1967831275064135797,https://x.com/MaDonseo/status/1967831275064135797,元々動画の方向性からしてもまともなYouTuberじゃないので今回のオープンマリッジ宣言も飽きられないための話題作りのような気も…。,MaDonseo,シメサバMen's,0,0,2
2025-09-16 15:03:26+09:00,1967831675272036389,https://x.com/iheukowakatomo/status/1967831675272036389,「見とれヒカル！　これが本物のオープンマリッジじゃああああーーーっ！！！」 すべてをオープンにして街を駆け出す全裸中年男性。それでも彼らがマリッジできないことが、この国の少子高齢化問題の大きな原因なのです。 #チンポを出さない自民党総裁選はいらない,iheukowakatomo,ヘアラストオーダーニコラス,0,0,0
2025-09-16 15:07:17+09:00,1967832642306667007,https://x.com/wada_dqx/status/1967832642306667007,イメージ商売してないヒカルはオープンマリッジ（不倫）しても迷惑かける企業がいないのだから地獄に落ちろと他人に言うのは別に間違ってなくね？  x.com/neko_no_geboku …,wada_dqx,さわだ,1,0,0
