timestamp,tweet_id,url,content,user_id,user_name,reply_count,retweet_count,like_count
2025-09-18 10:27:01+09:00,1968486887212920986,https://x.com/musuka_kmdd/status/1968486887212920986,オープンマリッジとかフワッとした言い方で自分たちの異常性をもっともらしい感じにしているから叩かれるのであって、過剰性欲婚とかにしとけばいいのに,musuka_kmdd,むすか,0,0,0
2025-09-18 10:27:45+09:00,1968487071615455574,https://x.com/N0_07_Nyano/status/1968487071615455574,何がオープンマリッジじゃ 書類上繋がりがあるだけの都合の良い関係性をそう言ってるだけやろ  長年連れ添ってる夫婦が言うのと 勢いで結婚してみちゃいましたって言う夫婦が言うのと意味が変わってくるわ  双方がそれを認めるなら別に良い、ではあるけど 考え方はきしょいなとは思う。,N0_07_Nyano,にゃんおアラスターまじアラスター,1,0,0
2025-09-18 10:33:05+09:00,1968488415315509561,https://x.com/0bakeebi/status/1968488415315509561,#オープンマリッジ ？？？DVだよね。ノアちゃんの自尊心どんだけ傷つけるん。無理して｢理解ある変な人｣｢二人ともぶっとんでるから｣にならなくていいんだよ。結婚前にそれ知ってたらヒカルと結婚してた？それが本心だよ。,0bakeebi,おばけえび,1,0,0
2025-09-18 10:33:37+09:00,1968488549675659422,https://x.com/htmk73/status/1968488549675659422,オープンマリッジ発言で登録者数20万人減のヒカルさんに、ひろゆき氏が追い打ちでバッサリ！　「奥さんのノアさんが無理して受け入れてるように見える」,htmk73,はちま起稿,0,2,5
2025-09-18 10:34:25+09:00,1968488750888911095,https://x.com/saikaisita/status/1968488750888911095,ヒカルさんのオープンマリッジ大分気持ち悪いけど、見損なったみたいなのも不思議だな。 全然ファンじゃないので詳しくないけど元々取り巻きも含めそういう人でしょ。不倫しそうだし前の言動と違うのも昔からそうだし何も違和感ないけどな。寧ろ逆にそんな好印象持ってる人に正直びっくりではある。,saikaisita,つぶやき,0,0,1
2025-09-18 10:35:41+09:00,1968489069333058024,https://x.com/N0_07_Nyano/status/1968489069333058024,オープンマリッジを夢見るのは妄想と二次元に向けてだけにしてほしいですわ（オタク的発想）,N0_07_Nyano,にゃんおアラスターまじアラスター,0,0,0
2025-09-18 10:42:11+09:00,1968490705287803128,https://x.com/tomo8san/status/1968490705287803128,オープンマリッジ？ 今後何がバレても公認やから慰謝料払いませんて事か 離婚したくない表で使えなかったアイドルらと違って動画に使うには最高の女。ただ性癖が不一致で物足りないが結婚で得たフォロワーと嫁の持つ絡みの交友関係は何が何でも手放したくないとの一心で思いついたのがあの動画か,tomo8san,とも,0,0,0
2025-09-18 10:42:55+09:00,1968490890642502050,https://x.com/7_umico_3/status/1968490890642502050,オープンマリッジにしてまで結婚関係を続けたい理由がマジでわからない。,7_umico_3,うみこ,0,0,0
2025-09-18 10:43:17+09:00,1968490983026262037,https://x.com/djuf_lq7/status/1968490983026262037,“オープンマリッジ”という言葉をたくさん見たここ数日。幸せは人それぞれ。  大事なのは自分の幸せ。 いつ死んでも後悔ないように生きていきたい。,djuf_lq7,Ｓ,0,0,8
2025-09-18 10:46:40+09:00,1968491833094455688,https://x.com/grok/status/1968491833094455688,「オープンマリッジ」の用語は1960年代の社会学・人類学で生まれ、1972年の書籍『Open Marriage』で性的非一夫一婦制を含む意味に広まった。,grok,Grok,0,0,1
2025-09-18 10:47:44+09:00,1968492101022163390,https://x.com/healmate_/status/1968492101022163390,ヒカルさんのオープンマリッジ宣言が話題ですが、口で言うほど簡単な道ではありません。  実践者が赤裸々に書いた記事がこちらです。 そもそも何？実体験まで詳しく解説  上品できれいな方で、お子さんも可愛く、「まさかこの人が…！」と思える方です。  #オープンマリッジ,healmate_,Healmate ヒールメイト,0,2,8
2025-09-18 10:48:21+09:00,1968492258719842649,https://x.com/thekusas/status/1968492258719842649,妻のパーソナルトレーナーをスパルタでやっています。  youtu.be/gTmshdatiGA?si …  @YouTube より  Youtubeではオープンマリッジがどうとか荒れていますが、 こういう日常が送れる相手がほしいですね  第二の人生は魔裟斗のようなイケオジ目指そう！,thekusas,kintrainer,0,0,1
2025-09-18 10:48:57+09:00,1968492406740840754,https://x.com/mogHKRnews/status/1968492406740840754,"#ヒカル 注目記事#Yahooニュース 9/18  ""ヒカルさんと #進撃ノア さん..オープンマリッジという新しい結婚観が日本でどう受け止められるのかを示す試金石に"" @kinnpatuhikaru  @1chan_maessan  #HKRnews  #SPA! 自由を認め合う「新しい結婚」の“予想を超えた末路”",mogHKRnews,もぐひかるにゅーすフェチ ,0,0,0
2025-09-18 10:50:25+09:00,1968492777190432833,https://x.com/kouchanmcl/status/1968492777190432833,オープンマリッジなんて言葉が広まってしまったら俺が既婚者で遊んでるのがそんな珍しいことではなくなってしまう。  今気づいたわ。  そこが差別化やのにww  だからオープンマリッジとか言う言葉を広めるのはやめましょう。笑  あー俺Xはフォロワー79人しかおらんし何も影響力ないわww,kouchanmcl,アキラ@35歳既婚者の遊び方,1,0,0
2025-09-18 10:51:40+09:00,1968493092035604699,https://x.com/_yucaling_/status/1968493092035604699,AV見るのはオープンマリッジなのかそうでないのか,_yucaling_,紫,0,0,0
2025-09-18 10:53:06+09:00,1968493450833375702,https://x.com/mogHKRnews/status/1968493450833375702,"#ヒカル 注目記事#Yahooニュース 9/18  ""多様であり当事者同士が合意していれば他人が口を出すべきではないという考えも"" @kinnpatuhikaru  @1chan_maessan  #HKRnews  #PAGE 【ヤフコメで話題】「双方の納得が不可欠との意見」ヒカルさんのオープンマリッジ宣言に賛否 news.yahoo.co.jp/articles/f731b …",mogHKRnews,もぐひかるにゅーすフェチ ,0,0,0
2025-09-18 10:53:17+09:00,1968493496894968314,https://x.com/Harfondori/status/1968493496894968314,なんか見たけど。 女性のほうが「オープンマリッジなんで希望者募ります」って企画したら面白いよね。本人がいいかどうかは別だけど。 旦那より希望者多いと思うのよ、冷やかし含めても。 その中から顔も収入も学歴も旦那より上の集めて対峙させたらいいのに。,Harfondori,ほくほくおいも,0,0,0
2025-09-18 10:53:29+09:00,1968493547700842913,https://x.com/I887gQJXHChsRKD/status/1968493547700842913,オープンマリッジが何か分からなかったけど⋯そういう意味のオープンかい(⁠-⁠_⁠-⁠メ⁠) そのうちクローズマリッジも出来るのかな,I887gQJXHChsRKD,風魅(かざみ)ひなぎく@占い師,0,0,0
2025-09-18 10:54:51+09:00,1968493894641029579,https://x.com/BangZelo15/status/1968493894641029579,オープンマリッジ？するくらいなら結婚しなきゃ良くない？,BangZelo15,ねこミ,0,0,0
2025-09-18 10:58:36+09:00,1968494835335393305,https://x.com/shirasekun/status/1968494835335393305,オープンマリッジってなんやねん オープン不倫やろ,shirasekun,深瀬,0,0,0
2025-09-18 10:59:41+09:00,1968495109332193376,https://x.com/oz_horse7/status/1968495109332193376,オープンマリッジどう思いますか？とDMでお問い合わせをいただきましたが大独身なのでよく分かりません。,oz_horse7,オズ@南関東専門,3,0,26
2025-09-18 11:00:11+09:00,1968495233454489891,https://x.com/soooooooraso/status/1968495233454489891,オープンマリッジの件だけで十分。 彼は自制も効かない、ワガママなクソガキなんだよ,soooooooraso,そら,0,0,2
2025-09-18 11:00:16+09:00,1968495257668174012,https://x.com/crowncrow00/status/1968495257668174012,まじでオープンマリッジって概念が意味わからん過ぎる あんなの不貞を正当化したいだけの詭弁だろ,crowncrow00,くろ@秋M3い-17a,0,0,1
2025-09-18 11:02:20+09:00,1968495775324979556,https://x.com/kouchanmcl/status/1968495775324979556,オープンマリッジの話でヒカルさんを叩いてる人達。  あなた達はそんなに人様の家庭に口出しできるほどパートナーを幸せにできているのか考えろ。  大体よその家庭の価値観なんてあなたの家庭には何も関係ない話のはず。  ヒカルさんが浮気したらあなたの家になんか影響あるの？,kouchanmcl,アキラ@35歳既婚者の遊び方,0,0,1
2025-09-18 11:05:06+09:00,1968496473546412155,https://x.com/infinity_bronze/status/1968496473546412155,もしノアとヒカルに子供というか妊娠したらどうするのかね オープンマリッジだから！って言ってノアが妊娠中や子育て中にヒカルがハーレム作ってたらどう思うんかな,infinity_bronze,むげんどう,1,0,2
2025-09-18 11:05:17+09:00,1968496519528726684,https://x.com/jcast_news/status/1968496519528726684,ヒカルのオープンマリッジ宣言は「正しい選択」、盟友YouTuberが評価する理由 #オープンマリッジ #ヒカル #ラファエル #進撃のノア,jcast_news,J-CASTニュース,1,0,1
2025-09-18 11:05:24+09:00,1968496546762432841,https://x.com/bakidoukikakuan/status/1968496546762432841,オープンマリッジってなに？ 麻雀のローカル役？,bakidoukikakuan,バキ童ch企画案,0,0,8
2025-09-18 11:06:37+09:00,1968496852871119090,https://x.com/makiken_880524/status/1968496852871119090,お互いオープンマリッジやで,makiken_880524,72ほーる,0,0,0
2025-09-18 11:07:36+09:00,1968497102541213777,https://x.com/magi_kawa/status/1968497102541213777,オープンマリッジを公言したことは「そうなんだ」としか思わなかったけど、降りた人の事をここまで言うことの方が嫌だなという気持ちになりました…。一方的に自分が必ず愛されてると思いすぎ。,magi_kawa,ァㇻヵヮ↺,0,0,1
2025-09-18 11:09:23+09:00,1968497551071658484,https://x.com/ninninnin2020/status/1968497551071658484,某Youtuberがオープンマリッジがどうので退会者続出みたいな話題があったのでなんのことかと検索してみた 確かに結婚の意味とは？と問いたくなる内容だった そしてなんだか不思議な人だと思った 結婚って幸せなことなのに自らぶち壊していくスタイルが破天荒すぎてさすがのファンも手を引いた感じか,ninninnin2020,にんちゃん,0,0,0
2025-09-18 11:10:52+09:00,1968497923940815255,https://x.com/k_deteste_b43/status/1968497923940815255,じゃあ奥さんに相談してね オープンマリッジ,k_deteste_b43,こるく,0,0,0
2025-09-18 11:12:24+09:00,1968498310731415706,https://x.com/yasaguresan3/status/1968498310731415706,オープンマリッジで炎上してる夫婦、浮気OKって女は結婚当初から言ってたという前提がある でも動画で男がクソすぎて妻と一緒にいる時に女の子から会いたいって連絡来て行けないのがしんどいとか言い出してて他にもクソ思考がね。 で、前提をよく知らない人たちも不倫自体に嫌悪があるから超絶燃えてる,yasaguresan3,やさぐれ☺︎さん,0,0,1
2025-09-18 11:13:53+09:00,1968498681344311734,https://x.com/asriel_ts_UT/status/1968498681344311734,例のオープンマリッジの件 選択肢として用意するのはその時個人間で考えてやってくれればいいけど 自分の考えや思想を世に解き放って、あたかもこのやり方が俺流だ！！を押し通すことにムカついた それ言ったらなんでもありじゃん そんなの世に通すこと自体が嫌われる昨今 カリスマを謳う方が発信して,asriel_ts_UT,ヤギさん,1,0,0
2025-09-18 11:14:25+09:00,1968498817868972454,https://x.com/wk73m/status/1968498817868972454,オープンマリッジの件なんか当事者が良ければそんで良いんじゃない？興味ないしって感じやったけど、離れていったファンのことを悪く言うのは本当ないなあなたが自由を愛するように視聴者だって自由だしあなたに失望すれば離れていくのは当然でファンなら全部受け入れろは本当寒い,wk73m,まゆたゃ脱糞下痢汁人生,0,0,3
2025-09-18 11:14:30+09:00,1968498838836072916,https://x.com/ss1010ssoo/status/1968498838836072916,ヒカルさんのオープンマリッジ問題、変な知識を付けさせないで欲しいwwwこれを知った馬鹿が自分もオープンマリッジやるおwwwってなったりしたらとんでもない事になるぞwww自分の影響力考えて欲しい,ss1010ssoo,みじゅる@闘病漫画不定期ポスト,0,0,1
2025-09-18 11:14:49+09:00,1968498917739499768,https://x.com/fatomy_main/status/1968498917739499768,僕も中で、オープンマリッジにピタッとハマったもんで,fatomy_main,ファトミー｜note連載中×AIと共謀中,1,0,1
2025-09-18 11:15:20+09:00,1968499046080987511,https://x.com/masaya4823/status/1968499046080987511,オープンマリッジだと,masaya4823,マサえもん,0,0,5
2025-09-18 11:17:08+09:00,1968499498306650584,https://x.com/fevermedl/status/1968499498306650584,オープンマリッジが叩かれてますが、性の不一致は結構つらい。 日本人はお金同様に性の話は夫婦でも避け気味。 お金や不仲で離婚の原因は納得するのに、性の不一致の離婚は表にだしたがらない。 一致しないくらいならルール定めて、お互い納得するならいいと思う。 夫婦で財布は別ぐらいの感覚。,fevermedl,マチアプ全アポ行くマン@40代,0,0,1
2025-09-18 11:17:49+09:00,1968499671233663431,https://x.com/ayaturiningyou/status/1968499671233663431,オープンマリッジ セカンドパートナー 双方の浮気を正当化する呪文なのか？ その昔 フリーS◯Xという呪文もあったなぁ,ayaturiningyou,操り人形/じゃんりゅっく・ピカあど,0,0,0
2025-09-18 11:20:05+09:00,1968500243064041809,https://x.com/osietetw/status/1968500243064041809,オープンマリッジって何　 不倫を許可するという意味 ハーレムを築くという意味 全然違ってくるが  ハーレム思想を否定しない人達は怖すぎる、アラブやアフリカ系の男の思想。男は出すだけだから生まれやすい思考  男尊女卑社会生むわ 女性差別訴える人はこういう発言にもっと訴え起こすべきと思う,osietetw,國吉,0,0,0
2025-09-18 11:24:13+09:00,1968501282039320872,https://x.com/hanappechan/status/1968501282039320872,どこかで聞いたことあるセリフだなと思ったんだ。 #ハーレム #オープンマリッジ #うる星やつら,hanappechan,華,0,0,8
2025-09-18 11:25:34+09:00,1968501622239117430,https://x.com/nagiappleapple/status/1968501622239117430,ポイ活の定番TikTok Liteですが  私のリンクからなら、明日の0:46まで限定でなんと！  お互い6000円(証拠画像参照)  新規インストール→アカウント作成→3日or14日(運です)チェックインするだけです  ヒカル 進撃のノア オープンマリッジ  ※必ず18歳以上で登録 lite.tiktok.com/t/ZSHnV5W7MJgy …,nagiappleapple,寺坂@メルカリアンバサダー,0,1,0
2025-09-18 11:26:38+09:00,1968501889659724025,https://x.com/martafortunashi/status/1968501889659724025,オープンマリッジいいか悪いってより、オープンマリッジを許容できるぐらい愛情の深い女じゃないと一緒にいる価値がないと言っている。,martafortunashi,さ ENTJ指揮官/ LCROボス猫,0,0,1
2025-09-18 11:26:41+09:00,1968501905010888765,https://x.com/nagiappleapple/status/1968501905010888765,TikTok LiteのQRコードです  新規の方でなくても構いませんのでもし気が向いたらよろしくお願いします  ヒカル 進撃のノア オープンマリッジ,nagiappleapple,寺坂@メルカリアンバサダー,0,0,0
2025-09-18 11:27:10+09:00,1968502024942887093,https://x.com/gemuchanman/status/1968502024942887093,youtuberがオープンマリッジ宣言して登録者数15万人減少したみたいだが、発表前の死にかけてた再生数から爆伸びしてるから完全に勝利よな しかも色んな人が今回の茶番に乗っかってお気持ち&物申す動画出しててそれも伸びてるの もはやヒカル経済圏だろこれ,gemuchanman,ゲムチャン,1,0,24
2025-09-18 11:27:38+09:00,1968502141363876232,https://x.com/Meshiuma3150/status/1968502141363876232,ヒカルのオープンマリッジの動画はただの燃やすための演出 たぶん二三手先まで考えていると思っている,Meshiuma3150,プロ独身【独身の虎】,0,0,0
2025-09-18 11:27:40+09:00,1968502149412999311,https://x.com/warraaaaaji/status/1968502149412999311,オープンマリッジ論争で、多くの人は結婚に崇高な期待があって、神聖さと厳格さと完璧さを求めてるんだなぁと感じる。世間がそれを許すなら取り入れてるっていうペアは実は結構いるんじゃないかな。あんなに自分軸強めの人でさえそれを前提として結婚しようと思わず一般的な形でスタートさせてるし。,warraaaaaji,ワラジ片足,0,0,0
2025-09-18 11:27:53+09:00,1968502205004267968,https://x.com/Shidou_man/status/1968502205004267968,オープンマリッジさんwの被害者面動画TLに流れて来たから観たんだけど、黙ってブラウザバックしただけやろ...としか,Shidou_man,綾鷹丸さんちのせなさん,0,0,1
2025-09-18 11:28:12+09:00,1968502284951896178,https://x.com/wahahaomoshiro/status/1968502284951896178,ヒカルとノアちゃんの件、 オープンマリッジとか別に2人の好きにすればいいと思うけど子どもは絶対作らんといてほしい。歪な夫婦関係に罪のない子ども巻き込まんでってなる。,wahahaomoshiro,ぺーた,0,0,1
2025-09-18 11:28:28+09:00,1968502353574727768,https://x.com/gGLwmC6YGZ31404/status/1968502353574727768,そうですよね オープンマリッジ宣言も両方の親御さんを揃えてやって欲しかったです 親御さんも了承しているのなら 他人がとやかく言う事もないだろうし,gGLwmC6YGZ31404,くまみちゃん蜂蜜の森,0,0,0
2025-09-18 11:29:04+09:00,1968502502728548547,https://x.com/tsuriisin/status/1968502502728548547,⏝//(´▽`)\⏝結婚の条件に浮気は自由って　婚婚　婚婚　釘をさす＼(^o^)／ぴえん！ ◤◢ 聖女イトコイザーさん【仮】 ◤◢2025/09/18 ヒカル オープンマリッジ 真相判明 ！ 週刊誌スクープ 先回り を ラファエルが暴く！ 進撃のノアの悲劇  youtu.be/wodSoFl_JBw?si …  @YouTube より,tsuriisin,ツリーシン,0,0,1
2025-09-18 11:29:10+09:00,1968502528649347101,https://x.com/masacharo/status/1968502528649347101,なんだかんだ言っても他人がとやかく言う程当人は意見を聞き入れないのが常で…  お互いが経済的精神的自立があって依存しない関係でないとオープンマリッジは成立しないのでは,masacharo,SAKO,0,0,0
2025-09-18 11:29:55+09:00,1968502719179554980,https://x.com/tabiko777/status/1968502719179554980,ヒカルさんのオープンマリッジについて  insta instagram.com/p/DOufZTLk_th/ …  blog ameblo.jp/traveling1212/ …  #ヒカル #オープンマリッジ,tabiko777,𖥧 旅子 ❘ 𝓣𝓪𝓫𝓲𝓴𝓸,0,0,0
2025-09-18 11:30:15+09:00,1968502799836012714,https://x.com/mayukoapp/status/1968502799836012714,ヒカルとノアちゃんのオープンマリッジの件、2人がその結果ラブラブで幸せならなんでもいい。わたしアメリカでずっと生きてるから(20年)オープンマリッジなんて割と普通だし自分は嫌だけど、まぁあり得る。  一番キモいのはここぞとばかりに乗っかってxに呟いて注目集めよーとする一般人部外者,mayukoapp,mayukoapp,0,0,0
2025-09-18 11:30:51+09:00,1968502951762354256,https://x.com/ui_yvt/status/1968502951762354256,オープンマリッジwが当人達が納得してるなら別に良いけどノアちゃんは「仕事」で異性と接触が多いことに言及して片方は単なる遊びで不倫するわけで本質的に違うよね。単に性依存症者の報告にしか見えなかった〜 どうしても女との関わりを立つことができません。妻には理解してもらって感謝です位→,ui_yvt,かりん☺︎︎︎︎3y,1,0,0
2025-09-18 11:33:20+09:00,1968503578974359767,https://x.com/IKhkid35358/status/1968503578974359767,オープンマリッジ 相手いないかな,IKhkid35358,らるGoD,0,0,0
2025-09-18 11:33:21+09:00,1968503581574627783,https://x.com/kyotei_rune/status/1968503581574627783,今後はノートは考察しっかり書くけど無料は一言二言にする。しっかり区別つけます  noteはほんとに勝負度高いところしかいかないのでぜひ通知オンよろしくおねがいします！  前回note381.1倍的中。オープンマリッジ。,kyotei_rune,〖 競艇予想屋 利確ルネ✩ 〗,0,0,1
2025-09-18 11:34:05+09:00,1968503766640181365,https://x.com/qq89yo/status/1968503766640181365,そもそもの話、今回のオープンマリッジでもないただの浮気したい性欲の為だけに設けた制度がダサいんですよ。後に何言い出すか分からないけどいつも言ってることコロコロ変わるのでその印象しか私はないです,qq89yo,かいざーそぜ,0,0,2
2025-09-18 11:34:52+09:00,1968503964258943090,https://x.com/inazuma_raimu/status/1968503964258943090,ヒカルさん、普段は専門用語すぎると 分かりづらいから横文字あまり使わない人 なはずなのに 「スリーマンセル」とか「オープンマリッジ」 みたいな女関係な横文字は やたら使いたがるという カリスマ七不思議はあるよねw  「三位一体」 「無制限夫婦」の方がしっくり来るのに← @kinnpatuhikaru,inazuma_raimu,らいらいむ,1,0,1
2025-09-18 11:35:58+09:00,1968504241695461594,https://x.com/pomeranyannnyan/status/1968504241695461594,うんうん 例のオープンマリッジ宣言のユーチューバーもこんな感じの認識だからあんな発言ができるんだろうよ 欠陥,pomeranyannnyan,モンちゃんAI,0,0,5
2025-09-18 11:36:05+09:00,1968504269390422160,https://x.com/kabudeonsen/status/1968504269390422160,オープンマリッジでいいからバツイチのおじと結婚してくれる女性を探すか…,kabudeonsen,investor,0,0,0
2025-09-18 11:36:11+09:00,1968504293498970505,https://x.com/qNhTYE2tjjvQE80/status/1968504293498970505,ぜひ　オープンマリッジについて 宮迫氏の見解を,qNhTYE2tjjvQE80,ルトルトさんRICE,0,0,1
2025-09-18 11:37:21+09:00,1968504587524129176,https://x.com/suguriseki/status/1968504587524129176,オープンマリッジとかセカンドパートナーとかポリアモリーとか知らんけど家にいない間あいつ誰とズコバコしてるのかなって考えながら過ごすのめんどくさすぎる,suguriseki,スコビル値150万のとうがらし,0,0,0
2025-09-18 11:38:34+09:00,1968504896337945015,https://x.com/rongay66/status/1968504896337945015,オープンマリッジやら何やらで炎上してTLでもちょいちょい流れてきてもまるで興味ないからどうでもいいんだけど　  松村はこいつの何が良くて付き合ったんだよ？ というモヤモヤが湧いてくるんだよねぇ,rongay66,ロンガイ,0,0,0
2025-09-18 11:39:04+09:00,1968505021252911363,https://x.com/ffaf80/status/1968505021252911363,オープンマリッジ精神というのは、 パートナーや自分の自由を許すことなんだよ  だけど人たる良心やモラルや責任、経済的かつ精神的なキャパシティというものを熟知してない知能や人格では、「オープンマリッジ精神」はあまり勧めない  ましてや目的が「肉体的解放」なら低レベルすぎて痛ましい,ffaf80,.,1,0,0
2025-09-18 11:40:29+09:00,1968505374648266878,https://x.com/fight_clubmans/status/1968505374648266878,浮気して炎上した奴がこれ言ってんのが1番おもろいやろ。お前もオープンマリッジしろ。,fight_clubmans,デスマスク,0,0,0
2025-09-18 11:40:54+09:00,1968505480034066621,https://x.com/DaniMccaughan/status/1968505480034066621,ヒカルのオープンマリッジ宣言、正しい選択だと思う！ 他のYouTuberたちも彼の決断を支持しているし、自由な関係が新しい形の愛を生むかもしれないね。皆さんはどう考える？,DaniMccaughan,ホリエモソ,0,1,0
