timestamp,tweet_id,url,content,user_id,user_name,reply_count,retweet_count,like_count
2025-09-17 10:20:04+09:00,1968122752839336201,https://x.com/mizu_nonaka_/status/1968122752839336201,"オープンマリッジを受け入れられるかって聞かれたら受け入れられない人は多くて当然な気が 自分の思想1回捨てて、許さざるを得ない状況を予想してみれば""そういう人もいるよな""となる ただ自分にその気（パートナー以外との性行為が必要）がないから、浮気や裏切りを感じてしまっているだけだと思う",mizu_nonaka_,海底,0,0,2
2025-09-17 10:20:10+09:00,1968122775891218615,https://x.com/Hokkaidohiguma/status/1968122775891218615,なーにがオープンマリッジだよ。格好つけて横文字にすんじゃねぇよ。気持ち悪ぃもん見せんな。,Hokkaidohiguma,ひぐま喘息ネキとド癇癪36m,0,0,8
2025-09-17 10:22:22+09:00,1968123331493892209,https://x.com/mtmt00010/status/1968123331493892209,叩かれるのが嫌なら人知れずハーレムでもオープンマリッジでもすりゃあ良いのに,mtmt00010,mt【反NHK党の蒼き混沌】,1,0,2
2025-09-17 10:22:43+09:00,1968123419372970271,https://x.com/rersampei/status/1968123419372970271,オープンマリッジを批判している人をみて、既にうちは、オープンマリッジだよなぁと思っている皆様  今日も暑いですね。,rersampei,UNIQLOスーツを愛する不動産会社の社長,0,0,0
2025-09-17 10:26:34+09:00,1968124385254052300,https://x.com/sige3rd/status/1968124385254052300,オープンマリッジってオープンカレッジとかオープンキャンパス的なヤツだと勘違いしてました。今朝まで。 全然式場見学の話してるんだなって思ってた。 不倫公認ってことなんだね。,sige3rd,重盛･ｷﾗｷﾗﾊｯﾋﾟ-･ﾎﾟﾒラﾆｱﾝ,0,0,1
2025-09-17 10:27:26+09:00,1968124605912191191,https://x.com/ma0101xx/status/1968124605912191191,オープンマリッジとかいいから  一途で生きてください、みなさんw,ma0101xx,mayu,0,0,7
2025-09-17 10:28:17+09:00,1968124818273997140,https://x.com/Longe0829/status/1968124818273997140,別にオープンマリッジでもポリアモリーでも本人がよければどうでもいい。通俗的な性規範/倫理なんて捨てても構わないと思う。 ただ自称ポリアモリーを数人見てきたけど「自分がするのははいいけど相手は」だったり、通俗道徳が自覚以上に根付いていてどこかで自己矛盾により破綻することが多い。,Longe0829,ろんげー,1,1,5
2025-09-17 10:30:48+09:00,1968125452469539033,https://x.com/karoonotaku0924/status/1968125452469539033,趣味とは関係のない話だけど、YouTuberのヒカル氏のオープンマリッジ宣言、あんまり他人の価値観に色々言いたくないんだけど、あれ本当に反吐が出る。 なにが浮気してもOKだよ…ふざけんなって思ったな。,karoonotaku0924,かろーん。,0,0,2
2025-09-17 10:33:49+09:00,1968126210590019636,https://x.com/yuu_prlife/status/1968126210590019636,結婚する前に「オープンマリッジ」っていうならご自由にどうぞって感じだけど、結婚してから「俺浮気するのがデフォだから」と言ってオープンマリッジです！ってドヤってるあたりまじでお金稼ぐまでモテたことなかったんだろうなって一人の女性を愛せないの可哀想って思ってしまった。,yuu_prlife,由羽@ベンチャー広報,0,0,0
2025-09-17 10:36:33+09:00,1968126897629671815,https://x.com/shinshimmta/status/1968126897629671815,オープンマリッジで浮気していいけどお前と結婚するって男が不利なだけで女性からしたらいいことしかないだろとおもう。好きなときに種を選別できる。妻の子を夫は実子として育てる 浮気は離婚の要因にはならない。好きな人できたから別れようは通じない。のに女性は好きな人の子を産める。,shinshimmta,岡晋太郎,0,0,0
2025-09-17 10:41:01+09:00,1968128022390903235,https://x.com/numachinomajo/status/1968128022390903235,オープンマリッジって本人同士は納得してても子供が生まれたら子どもが迷惑被ることになりかねないから、しっかりそこはそういう方針の家庭だからこどもの遺伝学的親が誰でも子供は責任持ってその家庭の子として養育されることを約束しとかないととか思った。 あまりこのスタイルは増えないと思う。  x.com/nnmmnpi/status …,numachinomajo,numachi,0,0,1
2025-09-17 10:41:29+09:00,1968128142188666968,https://x.com/nobimote/status/1968128142188666968,以下の内容が学べます  大炎上したオープンマリッジ宣言  殺到する批判と致命的な間違い 夫婦パートナーシップとアウフヘーベン オープンマリッジは善か悪か？歴史背景・子への影響 エーリッヒ・フロムの『愛するということ』 浮気を許容する隠れたデメリット  #ヒカル #ヒカル炎上,nobimote,のび太郎｜『The One』たった１人の最愛の女性と結ばれるために,0,0,1
2025-09-17 10:41:44+09:00,1968128205115756651,https://x.com/chilime/status/1968128205115756651,オープンマリッジなる言葉が流れてきたのですが、婚前の不特定多数との関係ですら性病リスクやら後で知らない子供が出てくるリスクやらあってモニョるのに、結婚した状態で他の異性と関係持つのって性病リスクだけでなく家族を危険にさらしたりお金で揉めたりと将来に禍根残すリスクありますよね…。,chilime,ちらいむ,3,34,189
2025-09-17 10:42:16+09:00,1968128339182485942,https://x.com/ifrit77010588/status/1968128339182485942,ニュースで見たけど、何十年も生きてきてオープンマリッジとかいう言葉を初めて聞いたわ・・・いろんな人がいるなぁ。,ifrit77010588,みかん,0,0,0
2025-09-17 10:43:16+09:00,1968128589502746800,https://x.com/Aryuuu_wanwan/status/1968128589502746800,オープンマリッジだのセカンドパートナーだの なんか気取った呼び方してるけど、 要するにセフレって事でしょ？？,Aryuuu_wanwan,ありゅー@Twitch Vstreamer,0,0,0
2025-09-17 10:44:35+09:00,1968128922962567374,https://x.com/__jr_o0/status/1968128922962567374,セカンドパートナーは不倫相手1人 オープンマリッジは何人とでも何回でも！ みたいな印象あるな,__jr_o0,• - •̥♡,1,0,7
2025-09-17 10:45:03+09:00,1968129039509622821,https://x.com/sirabee_news/status/1968129039509622821,「オープンマリッジ」を宣言して炎上しているヒカルについて、ラファエルが言及。思わぬ迷惑をこうむっていることを明かし、注意を呼びかけている。,sirabee_news,Sirabee／しらべぇ【公式】,0,0,0
2025-09-17 10:45:45+09:00,1968129215607525479,https://x.com/kakuresaitama/status/1968129215607525479,オープンマリッジ ノア　 ヒカル ウルトラジャパン  その他オススメミュートワードある？  なおこの四つを入れて田中圭、永野芽郁を解除しました,kakuresaitama,けんけん@限界仙人,3,0,16
2025-09-17 10:45:53+09:00,1968129247542907326,https://x.com/MoKusakabe/status/1968129247542907326,オープンマリッジのYouTuberの話どうでもいいんだけれど、ずっと流れてくるので一言…プレイボーイでも世間的に許される男性って実は妻に頭が上がらない、妻には下手に出る「愛嬌」みたいなので許されている雰囲気があったけれど、彼の場合、妻にマウントをとってる感じが単純に怖かった,MoKusakabe,日下部元美 Motomi KUSAKABE,3,3,20
2025-09-17 10:46:08+09:00,1968129309115297994,https://x.com/ao_agegap/status/1968129309115297994,僕個人としては、 オープンマリッジは少子化対策もありガチ推奨なんだけど、  ノアが整形顔であの表情なければ、痛々しく感じなかったと思うんだよね。  整形の人は、どうしても恋愛とか気持ちベースで動作するよりも、コンプレックスベースで動作してしまう。,ao_agegap,あお｜40代からの「年齢差恋愛」自己変革論,0,0,0
2025-09-17 10:47:35+09:00,1968129676351832260,https://x.com/sssk080808/status/1968129676351832260,オープンマリッジの人34歳らしくて衝撃もっと若者かと…！,sssk080808,もんた資格勉強アカウント,0,0,2
2025-09-17 10:48:26+09:00,1968129889141395912,https://x.com/yaoyao11yaoyao/status/1968129889141395912,オープンマリッジとかしたいならすりゃええけどどう見てもテメェの都合でしかねェのでなのがダセェ。 結婚とかその周りの制度、信用って欲しいよね。親周りのアレもアレだろうしさ。 てか誰,yaoyao11yaoyao,こーすけyaoyao＼毎試合優勝するDET／,0,0,0
2025-09-17 10:48:37+09:00,1968129934897057943,https://x.com/iguana_sun/status/1968129934897057943,オープンマリッジてなんや 結婚発表するときに言ってたらよかったのに、結婚後数ヶ月して言うからみんな疑問に思ってるんじゃないの？隣で奥さんニコニコしてるけど本当に心から笑ってる？納得してる？私にはそう見えないし、自分だったら絶対嫌だわ、理解できない,iguana_sun,MT𓆌𓁉,3,0,21
2025-09-17 10:48:38+09:00,1968129939665981678,https://x.com/nacchi_ugogo/status/1968129939665981678,オープンマリッジは、個人的には「ご勝手に」だけど、「人間」として考えると良くない文化だなって思ふ。乱交と変わらないにゃ。あの2人の性格的にはセーフかもしれないけれど、人間としては間違った選択だと思ふ。「私たちの勝手やん」が全て通っちゃうのは普通にヤバい。,nacchi_ugogo,千夏ナッちゃんω@スタレゾ、モンハン(MHO)待機,0,0,2
2025-09-17 10:50:23+09:00,1968130379178824003,https://x.com/breitlingyokoo/status/1968130379178824003,ヒカルの双方の浮気許容する「オープンマリッジ」宣言  結婚してすぐにこれか。 気色悪い。,breitlingyokoo,TAICHO,0,0,4
2025-09-17 10:50:33+09:00,1968130420706513219,https://x.com/richannn_rr0209/status/1968130420706513219,オープンマリッジ私はやだ そんなこと旦那が言い出したら離婚するよなぁぁぁ,richannn_rr0209,りちゃん,0,0,3
2025-09-17 10:50:48+09:00,1968130483629506754,https://x.com/biz_kurichan/status/1968130483629506754,周りのハイスペ男性の奥さん見てると、見逃し力というかスルー出来る力が高い女性しかいないなと思う。  オープンマリッジまではいかずとも、鎖に繋がず、半分野良犬くらいに思ってます的な夫婦は多そう。,biz_kurichan,わさびのくりやま,2,1,90
2025-09-17 10:53:34+09:00,1968131181020615120,https://x.com/ryonaterasu/status/1968131181020615120,素人はノイズ（雑音）を排除してオープンマリッジしてればいいんだよ！,ryonaterasu,長谷川餓翼,0,0,0
2025-09-17 10:53:53+09:00,1968131260351684688,https://x.com/lala_ruuu/status/1968131260351684688,オープンマリッジ？？？ 別にお互い納得してれば周りがとやかく言うことではないのかもだけど よっぽどの人じゃない限り納得してても女性は心が疲弊しそう  なんか関係ないのに私もしんどいもん,lala_ruuu,lala@小鼻の傷治療中,3,0,37
2025-09-17 10:55:24+09:00,1968131643996246334,https://x.com/my_ideal_is/status/1968131643996246334,今後DDのことはオープンマリッジと呼ぶことにした,my_ideal_is,そら,0,0,2
2025-09-17 10:56:05+09:00,1968131817023869392,https://x.com/Nekoprince_rev/status/1968131817023869392,オープンマリッジ… みんなは相手が浮気するの平気？  ボクは多分許さないなぁ…,Nekoprince_rev,猫王子@まぐりば,1,2,23
2025-09-17 10:58:03+09:00,1968132311175868791,https://x.com/Sigirei0201/status/1968132311175868791,独占欲強くて嫉妬深い俺はオープンマリッジに不向きでございます…,Sigirei0201,シギレイしぎれい,0,0,0
2025-09-17 10:59:50+09:00,1968132760272507198,https://x.com/NyaromeNyanya/status/1968132760272507198,オープンマリッジか…人それぞれとは思うけど目の前の人すら大切に愛する事も出来ず、あんな顔をさせるのはアカンやろな 自分は来年どんな状況か分からない。だから目の前の嫁さんと子供達を精一杯愛する事で十分だと思ってるし、まだまだ愛し足りないと思ってる。もっともっと時間が欲しいな～。,NyaromeNyanya,Ny@ロ〆,3,0,12
2025-09-17 11:00:06+09:00,1968132827314045029,https://x.com/whs_embrace3/status/1968132827314045029,資産が人並み以上にあるのに幸福そうじゃない人は珍しくない。小さい時に学ぶべきことは、「人を愛する力」「人を大切にする力」のような気がするんですよね。それができれば学校でのいじめもなくなるだろうし、オープンマリッジでどーのこーのみたいな話にもならんのでは？,whs_embrace3,雄町まい@雑多アカ,0,2,18
2025-09-17 11:04:25+09:00,1968133913911623749,https://x.com/marronnier_peko/status/1968133913911623749,「ノイズ」とか「素人」とか言葉選びと切り抜かれ方でかなり左右されてるなと思う オープンマリッジはようわからん,marronnier_peko,マロニエ,0,0,1
2025-09-17 11:04:52+09:00,1968134025522057422,https://x.com/sachi_ha1/status/1968134025522057422,"頼むから「俺は浮気するぜ。俺たちはオープンマリッジだ」って先に公言するのが""男らしい""と思うアホ彼氏増えないでくれよな。。本当に男らしいのは、",sachi_ha1,肉欲幸子,0,0,2
2025-09-17 11:05:49+09:00,1968134262538014957,https://x.com/qq89yo/status/1968134262538014957,久しぶりに私も5時から7時の恋人カンケイ観よう！面白いし、主役が小説家ということで紡がれる言葉がもうそれは切なく真をついていて最後は号泣。最後の最後嗚咽。もう最高の映画。 是非全映画好き、ヒカルのせいでオープンマリッジを勘違いしてしまった方に見て欲しい映画。 性欲の為にする事じゃない,qq89yo,かいざーそぜ,1,0,2
2025-09-17 11:07:58+09:00,1968134805176062263,https://x.com/Yuri266083261/status/1968134805176062263,もう、皆飽きてきたやろこの問題。 ヒカル「オープンマリッジ」採用しました。 部外者「へー」 ヒカル信者「へー(想定内)」 ヒカルファン「賛否」 ノア信者「発狂」 暇人アンチ「叩ける！！！」 貴方はどれ？,Yuri266083261,ユン○ン,0,1,0
2025-09-17 11:08:01+09:00,1968134819893903563,https://x.com/basjoo_Tosei/status/1968134819893903563,オープンマリッジに限らず元からある言葉を細分化したり横文字にするのは詐欺だから 詐欺じゃないにしても誤魔化す、騙す気があるのは確実だわ 今まさに問題になっているホームタウンとかね,basjoo_Tosei,桃青,0,0,0
2025-09-17 11:10:12+09:00,1968135366449451359,https://x.com/pandapan48/status/1968135366449451359,YouTuberのヒカル？さんをはじめて認識したけど、こう…オープンマリッジとか突拍子もないことを語る割に絶妙に垢抜けない芋臭さというか…ノアさんとの釣り合いのとれてなさが痛々しいお方ですね。コンプレックを芸に昇華できないとこうも残念感溢れる感じになるんだなと理解させられました,pandapan48,プリベェ,0,0,0
2025-09-17 11:10:43+09:00,1968135496594530675,https://x.com/T_fighter92/status/1968135496594530675,オープンマリッジの思考よりも女にキモい文面のLINE送っちゃうのが単純に無理だわ。個人間のやり取りとはいえ晒されるリスク考えてないのがますますキモい。スパイチュやココリコ遠藤から何も学んでいない,T_fighter92,TOKIO SILVA,0,0,1
2025-09-17 11:10:51+09:00,1968135530480275948,https://x.com/zuruzuru_mobale/status/1968135530480275948,ヒカルの嫁さんがオープンマリッジで自分の種じゃない子供産んだらなんて言うのか非常に気になる,zuruzuru_mobale,ずるずる,0,0,5
2025-09-17 11:11:06+09:00,1968135594296610830,https://x.com/h26ajx6cBESekdR/status/1968135594296610830,オープンマリッジ、騙されやすそうな性別を狙った新手の罠としか思えない。,h26ajx6cBESekdR,陳皮,0,0,10
2025-09-17 11:11:09+09:00,1968135605185081517,https://x.com/inazuma_raimu/status/1968135605185081517,大事な事やから何度でも再放送かの如く 言わせていただきますが、 ヒカルさんが滅茶苦茶な事を動画で 言っている時は8割ジョークです めちゃめちゃ分かりづらいブラックジョークです  先日のオープンマリッジ大炎上動画は 7〜8割、炎上商法が名目での発言 だったと見られますw,inazuma_raimu,らいらいむ,1,0,3
2025-09-17 11:14:30+09:00,1968136450618298565,https://x.com/takunogame_0815/status/1968136450618298565,オープンマリッジとかきしょすぎる,takunogame_0815,たくのすけ,0,0,0
2025-09-17 11:15:08+09:00,1968136609775358192,https://x.com/nayunps_udon/status/1968136609775358192,多様性、セカンドパートナー、オープンマリッジみたいな「自分にとって都合のいいこと」を単語化して表現することで、あたかも「世の中に認められている」感を醸すの増えてきてるね  個人的には否定する気はないが、圧倒的少数な考え方ってのは常に念頭において発言した方がいいんじゃないかなとは思う,nayunps_udon,なゆ,0,0,0
2025-09-17 11:16:56+09:00,1968137060541456615,https://x.com/piyox_1231/status/1968137060541456615,ヒカル×ノア社長オープンマリッジが話題やけど、2人の動画見れるならなんでもいい〜,piyox_1231,とぅるー,0,0,0
2025-09-17 11:18:57+09:00,1968137567729242361,https://x.com/tsubu_no_nakami/status/1968137567729242361,ヒカルという人のチャンネル見たことないのだけど、最近Xで流れてきたらオープンマリッジがどうとかの話で…なんか、こういう変なのにやたら連続で捕まる女性いるなぁと思って。 みんな大事にしてくれる人と一緒になれたらいいのにな。,tsubu_no_nakami,粒,0,0,0
2025-09-17 11:18:59+09:00,1968137579188179331,https://x.com/OBORO_cc/status/1968137579188179331,オープンマリッジって笑笑 なんかカタカナでカッコつけてるけど公開公認不倫(笑)って言えばいいのに,OBORO_cc,朧*ﾟ,1,1,31
2025-09-17 11:20:39+09:00,1968137995816669524,https://x.com/momwww_4/status/1968137995816669524,私あのオープンマリッジの人が前からホント苦手でね...。九州のド定番ファミレスのジョイフルとコラボしてるときは写真見たくなくてメニュー開かず注文したりしてた、家から一番近かったし子どもが行きたいっていうときはさあの人のコラボが終わってロバート秋山さんに代わったときは大歓喜した,momwww_4,辺境の4児母@2029中受・雑多アカ,1,0,5
2025-09-17 11:21:02+09:00,1968138095020351644,https://x.com/tokupukuyaho/status/1968138095020351644,誰も傷つけず、優しいのに、強いメッセージ性のある投稿凄い。言いにくい立場だと思うが、詳細語らず、ヒカルさんのオープンマリッジ炎上後に動画投稿。当人2人はさておき、不快に思った方、現在進行中のサレ妻で傷つきを持つ方、普段下支えしてる主婦の気持ち等を代弁し、大分救ってるんじゃないかな,tokupukuyaho,やっほー霊界研究中,0,0,4
2025-09-17 11:23:47+09:00,1968138786250109186,https://x.com/Nohonor_Nanashi/status/1968138786250109186,それに比べてオープンマリッジってなんだよwww 既婚だけど珍棒振り回したいってハッキリ言えよ,Nohonor_Nanashi,ななし は また鬱悪化,0,0,5
2025-09-17 11:25:12+09:00,1968139144015774079,https://x.com/daisuki9110/status/1968139144015774079,まあ，オープンマリッジも自分悪者にしたネタかもだしね。,daisuki9110,みいさん,1,0,0
2025-09-17 11:25:42+09:00,1968139267353481289,https://x.com/wdhfr9805/status/1968139267353481289,なんか小難しい話してるけどさ、チャンネル登録解除した人って、単純に生理的に受け付けなかっただけじゃない? キモっで消しただけだと思うけど  「ノアから笑顔が消えている」ヒカル、オープンマリッジ宣言で登録者19万人減　「平等ではない」専門家（ピンズバNEWS）  news.yahoo.co.jp/articles/ec493 …,wdhfr9805,へもZZ,0,0,3
2025-09-17 11:26:26+09:00,1968139454826287554,https://x.com/RabbitRhubarb/status/1968139454826287554,オープンマリッジって結婚したてのペーペーが言うもんじゃなくて子供がある程度自立して家族としての絆ができてから話し合われるものだと思ってだからびっくり。ペーペーが口にしていいのは婚前契約にそれが盛り込まれていた時のみだわ。弱者男性ここに極まれりって感じでみっともない。ダサの極み。,·,@RabbitRhubarb,0,0,1
2025-09-17 11:27:01+09:00,1968139601232662817,https://x.com/420amago/status/1968139601232662817,「ノアから笑顔が消えている」ヒカル、オープンマリッジ宣言で登録者19万人減　「平等ではない」専門家（ピンズバNEWS） - Yahoo!ニュース  どうせまた復活するから○  オープンマリッジ…は公言しなくて よかったとは思うけどね 子供が出来たら尚更だし  お幸せに  news.yahoo.co.jp/articles/ec493 …,420amago,麻の子,0,0,1
2025-09-17 11:27:16+09:00,1968139662503100418,https://x.com/_345th/status/1968139662503100418,ヒカル関連のツイートが嫌でも目に入るな...３０代半ばでハーレムがなんだオープンマリッジがどうだみたいな学生時代の非モテコンプ引き摺り回して恥ずかしく...はないか...元情報商材屋さんやしね... 売れ出した？頃からずっと思ってるけどファン層全く分からんな...彼のどこを良しとしてるのだろうか,_345th,ゆ,0,0,3
2025-09-17 11:27:46+09:00,1968139787434430814,https://x.com/pinzubanews/status/1968139787434430814,「ノアから笑顔が消えている」ヒカル、“オープンマリッジ宣言”で登録者19万人減 「平等ではない」専門家 ,,,0,0,0
2025-09-17 11:28:30+09:00,1968139972311142464,https://x.com/thatbird/status/1968139972311142464,誰だか知らないけど、ハーレム作るっていう夫とオープンマリッジを受け入れる？妻の動画と観察コメント達が流れてきてて、、興味ないし知らんけど、自分が被害者になる事が受け入れられないから加害者のレベルに合わせて（同調する、歓迎する）加害を無かった事にしたいのって心理的にあるあるかもな。,thatbird,あの鳥 2y,1,0,1
2025-09-17 11:28:47+09:00,1968140042557346248,https://x.com/rpg34374902/status/1968140042557346248,オープンマリッジの件って、結婚発表した段階で言ってればよかったのに後出しなのが少しキモいかもです！,rpg34374902,うどん,0,0,0
2025-09-17 11:31:37+09:00,1968140759246442542,https://x.com/sj1119sogo/status/1968140759246442542,ヒカルが進撃のノアと結婚し、さらにオープンマリッジを発表したがそこは正直興味ない。 でもそれを叩いてるコメントが嫌なほど目に入ってくる。 有名だからといって正直な気持ちを話した人間を重罪人だと罵り、石を投げつけるように叩き続け、血だらけにしようとしてる。  そんな事して面白いか？,sj1119sogo,ジョリー,186,68,611
2025-09-17 11:33:02+09:00,1968141114508243127,https://x.com/muunoo33/status/1968141114508243127,オープンマリッジ ⇒  ameblo.jp/0101623/entry- … #アメブロ  @ameba_official より,muunoo33,muunoo ムーノー,1,0,0
2025-09-17 11:34:05+09:00,1968141376882901408,https://x.com/tenworldx/status/1968141376882901408,ゲイの世界だとオープンマリッジ的な人も多いから、男女の世界とは結構違うんだなと。同じな部分もあるけど違う部分は違う。もちろん完全に浮気0で付き合ってる人達もいるけど。あとなんかエネルギー量の多いアクティブな起業家で完全一途かつ遊んでない人って珍しい気がする。この人は遊んでるだろう,tenworldx,世界を巡るLGBT起業家てん固定ポスト見てね,2,1,16
2025-09-17 11:35:01+09:00,1968141612804145161,https://x.com/shun_deai/status/1968141612804145161,オープンマリッジは非難されながらも浸透していくでしょうね。 本音と建て前は違うから。 外見ではニコニコしていながら裏はドロドロ。 そういうもん。,shun_deai,出会い系マニア,0,0,9
