timestamp,tweet_id,url,content,user_id,user_name,reply_count,retweet_count,like_count,stance_label,stance_against,stance_favor,stance_neutral
2023-12-24 23:17:09+09:00,1738926793296687534,https://x.com/ohyama_yusuko/status/1738926793296687534,M-1の審査員は 好みが合う松本人志 一切ブレない博多大吉 高得点配りおじさん富澤 が個人的に好きかなぁ ,,,,,,NEUTRAL,0.3368704,0.29912895,0.3640007
2023-12-24 23:17:15+09:00,1738926816637944044,https://x.com/yoshida_g_g/status/1738926816637944044,令和ロマンもすごいし、松本人志もえぐい。,yoshida_g_g,よしだ,0.0,0.0,2.0,NEUTRAL,0.23032792,0.28952524,0.4801468
2023-12-24 23:17:58+09:00,1738926997445980537,https://x.com/Molvi_Toka/status/1738926997445980537,令和ロマンさん、おめでとうございます！松本人志さんの票が入るまでどきどきでした,Molvi_Toka,م و ل و ی,0.0,0.0,0.0,FAVOR,0.3322659,0.35529676,0.3124373
2023-12-24 23:18:18+09:00,1738927082829402388,https://x.com/9cck1/status/1738927082829402388,松本人志はあんまり詳しくないのでなんとも言えないのだが、大崎洋の証言とか本(プールの約束がどうとか笑いの深淵がどうとか)が出てるのでそれ踏まえないで評してもエアプでは。 証言を踏まえてビジュアルバムとかごっつを見返すくらいはすべきだろうと思うけども。,9cck1,9おcぉck,0.0,0.0,1.0,NEUTRAL,0.21244492,0.20324151,0.58431363
2023-12-24 23:18:33+09:00,1738927143588106635,https://x.com/PenchM1zu0/status/1738927143588106635,個人的には、松本人志さんの口から「モグライダーは売れてるからな」という台詞が出た時が一番痺れました。,PenchM1zu0,ペンチ水尾,0.0,0.0,2.0,NEUTRAL,0.2747664,0.25756127,0.4676724
2023-12-24 23:19:01+09:00,1738927261016043875,https://x.com/sutoraiku19/status/1738927261016043875,松本人志さんM1も良いけどガキ使ももう一度やってよ笑,sutoraiku19,YOSHIKI,0.0,0.0,1.0,NEUTRAL,0.30162987,0.2450288,0.45334134
2023-12-24 23:19:02+09:00,1738927266024005698,https://x.com/yoyunaiyochan/status/1738927266024005698,最終審査で令和ロマンに入れたのが松本人志、中川家礼二、ナイツ塙、大吉先生で、ヤーレンズに入れたのがサンド富澤、山田邦子、ともこ姉さんで、何となく傾向分かるのすごい。,yoyunaiyochan,余裕のないよっちゃん,0.0,0.0,1.0,NEUTRAL,0.2510323,0.28546348,0.46350417
2023-12-24 23:19:07+09:00,1738927286274138130,https://x.com/umauma0729/status/1738927286274138130,ともしげさん系の天然型ですよね  来年は本命当てまくりの 松本人志さん系の 天才型のFinさん見せてください,umauma0729,うまうま生活（ときどきタイガース,0.0,0.0,0.0,NEUTRAL,0.29627883,0.29811147,0.4056097
2023-12-24 23:19:15+09:00,1738927321908904038,https://x.com/jyojijyoji555/status/1738927321908904038,松本人志はしっかりしてましたね！ M-1グランプリ　令和ロマンおめでとうございます,jyojijyoji555,じょーじ。,0.0,0.0,9.0,FAVOR,0.30040976,0.39419842,0.3053918
2023-12-24 23:20:10+09:00,1738927548892152166,https://x.com/jyojijyoji555/status/1738927548892152166,松本人志の審査はしっかりしてましたね,jyojijyoji555,じょーじ。,0.0,0.0,2.0,FAVOR,0.25445798,0.4856398,0.25990224
2023-12-24 23:20:26+09:00,1738927617900986728,https://x.com/macmac1218/status/1738927617900986728,つまり素人と同じ視点で点数をつけることの出来る松本人志さんが適任で後の審査員は素人目線に立てないボンクラ共は不適切な人選ということですか？,macmac1218,マック in the place to be,0.0,0.0,0.0,FAVOR,0.32446775,0.38099727,0.294535
2023-12-24 23:20:48+09:00,1738927711291383872,https://x.com/fukusanity/status/1738927711291383872,松本人志がハマらなかった時に「わかってないの俺だけなんかなあと思って礼仁を見たら………」って言ってて大御所になっても自分に批判的なの偉いねと思った,fukusanity,グッドフクサニティ賞,2.0,4.0,132.0,NEUTRAL,0.3324381,0.2428299,0.42473194
2023-12-24 23:21:04+09:00,1738927777259438323,https://x.com/wasurejinobase/status/1738927777259438323,それはそうとして山田邦子は今年も採点基準がブレッブレでこういうのって慣れじゃないねんなって思いました。松本人志さんはさすがでした。,wasurejinobase,ショーン・ザ・タワーリング・インフェルノ,0.0,0.0,6.0,NEUTRAL,0.2580967,0.22777358,0.51412976
2023-12-24 23:21:29+09:00,1738927882318368850,https://x.com/fukusaco/status/1738927882318368850,松本人志が1本目に89点なんて付けたもんだから、新山がキレて見せ算やったと思ってる。 大会がつまらなくなった。 あの採点は間違い。  ,,,,,,NEUTRAL,0.30157068,0.2434068,0.45502254
2023-12-24 23:21:39+09:00,1738927924412305769,https://x.com/botcher_matsu/status/1738927924412305769,松本人志の採点とコメントが終始素晴らしかった,botcher_matsu,Sho,0.0,0.0,1.0,AGAINST,0.40877107,0.3720663,0.21916266
2023-12-24 23:21:43+09:00,1738927940958826751,https://x.com/otodesu_ttky/status/1738927940958826751,松本人志のこのペットボトルベコったみたいななんとも言えない口ほんと大好き,otodesu_ttky,おとうふ,0.0,3.0,85.0,NEUTRAL,0.2948975,0.25038746,0.454715
2023-12-24 23:21:47+09:00,1738927959153770687,https://x.com/otyatya135/status/1738927959153770687,さや香はマジで1本目も2本目もクソつまらんかったな。松本人志はちゃんと相対評価してて良かった。,otyatya135,あいうえ,0.0,0.0,1.0,NEUTRAL,0.19342862,0.29632086,0.51025057
2023-12-24 23:21:48+09:00,1738927961464811858,https://x.com/gahara_36/status/1738927961464811858,M-1見てる途中だけど松本人志がエンゾの年齢分かってたコメントが1番良い,gahara_36,くしろ【公式】,0.0,0.0,0.0,NEUTRAL,0.31065282,0.31391016,0.37543705
2023-12-24 23:21:54+09:00,1738927987826049425,https://x.com/nicoyoudeath/status/1738927987826049425,人志松本は笑い我慢する時は、ベロを出すからね  RT,nicoyoudeath,ヒザさん,0.0,0.0,0.0,NEUTRAL,0.24902493,0.26202238,0.48895273
2023-12-24 23:22:38+09:00,1738928169938538955,https://x.com/kirinkirin_23/status/1738928169938538955,もう松本人志の審査しか信用したくない,kirinkirin_23,アミメ,0.0,0.0,2.0,AGAINST,0.38612664,0.2745082,0.33936515
2023-12-24 23:23:10+09:00,1738928307176194266,https://x.com/yakisobadayo__/status/1738928307176194266,絶対そうっすよね！！！  毎年松本人志点数予想してるんですけど最初低すぎたせいでめちゃ点数付けづらそうすぎるやん！！てなってました92かワンチャン93くらいありえるかな思ってたのに,yakisobadayo__,焼きさば,1.0,0.0,1.0,NEUTRAL,0.32960087,0.29542696,0.37497216
2023-12-24 23:23:48+09:00,1738928463682400726,https://x.com/9cck1/status/1738928463682400726,松本人志の笑いの深淵がなんだったのか、という暫定的な答えを与えずして松本人志論が語ったり書けたりするのだろうか、という謎がある。 そして今の松本人志はなんだかんだでその深淵の先にはいないだろうと思うので、であればどのようにそれと距離を取って今の松本人志になったか考える必要がある。,9cck1,9おcぉck,1.0,0.0,0.0,NEUTRAL,0.27447805,0.21709022,0.50843173
2023-12-24 23:24:46+09:00,1738928709439279416,https://x.com/daihinmin_pan/status/1738928709439279416,松本人志えらすぎるとか言ってる人どこの国のお笑い大魔神？？？？？？？？？？,daihinmin_pan,大貧民,0.0,0.0,2.0,AGAINST,0.3494717,0.33935463,0.31117365
2023-12-24 23:24:58+09:00,1738928758160290167,https://x.com/CaininAoyama/status/1738928758160290167,松本人志に褒められたジェシカよかったな,CaininAoyama,ナツキング,0.0,0.0,1.0,NEUTRAL,0.30173692,0.3396533,0.35860983
2023-12-24 23:24:58+09:00,1738928758453928170,https://x.com/yu_suke_music/status/1738928758453928170,松ちゃんは1本目もさや香低かったんだよね 別に松本人志が絶対ともましてや全てなんて思ってないけど、松ちゃんのさや香の点数は全体で6位 俺の中でも4位か5位だったなぁ正直,yu_suke_music,ゆうすけ@CDJ2526全通,1.0,0.0,1.0,NEUTRAL,0.24056958,0.21702427,0.54240614
2023-12-24 23:25:14+09:00,1738928824296128709,https://x.com/teleporter_965/status/1738928824296128709,令和ロマンは順当に面白かったし、決勝ネタが強かったのも松本人志が言った通りで凄かった。ヤーレンズに3票入ったのが不思議なくらい差はあった気がする。 終始、女性審査員2人の点数付けに振り回された感じの大会だったのでは？ ,,,,,,NEUTRAL,0.25470126,0.31871435,0.42658433
2023-12-24 23:25:43+09:00,1738928947604369443,https://x.com/goldhighstart/status/1738928947604369443,,,,,,,NEUTRAL,0.2557792,0.31104654,0.43317425
2023-12-24 23:25:45+09:00,1738928954445267059,https://x.com/akanwalkeriute/status/1738928954445267059,松本人志の審査の点数付けが誠実すぎるが故に、さくっと高得点つける審査員の影響が大きくなるパラドックス,akanwalkeriute,とんぬら@こっそり起業日記,0.0,0.0,0.0,FAVOR,0.31955013,0.34698495,0.33346495
2023-12-24 23:25:58+09:00,1738929010128884135,https://x.com/Koala_fight/status/1738929010128884135,というか松本人志だけが令和ロマンの力を見抜いてさや香に80点台つけたところから全部の流れが決まった気がする,Koala_fight,自生のケシ,0.0,0.0,66.0,NEUTRAL,0.33013737,0.3025899,0.36727273
2023-12-24 23:26:43+09:00,1738929197475864591,https://x.com/frontale_01/status/1738929197475864591,クリスマスは散々はしゃいだ後、1人この曲を聴いてちょっと泣くのがここ数年の定番。  作詞は先ほどM-1の審査員をしていた松本人志。,frontale_01,とぅもねば,0.0,0.0,19.0,NEUTRAL,0.27589545,0.21979657,0.5043079
2023-12-24 23:26:52+09:00,1738929238185771115,https://x.com/rumine_fishbeef/status/1738929238185771115,マユリカ強火担の夫が「優勝いけたやろ！！」って静かにキレてる あたしのが松本人志に近くてごめんね,rumine_fishbeef,るみね,0.0,0.0,0.0,NEUTRAL,0.34470528,0.29650185,0.35879284
2023-12-24 23:28:06+09:00,1738929547402461585,https://x.com/doudeshow/status/1738929547402461585,ジョンソンが終わる発言の松本人志を非難する一同w,doudeshow,doudeshow,0.0,0.0,0.0,NEUTRAL,0.3128403,0.22596914,0.4611906
2023-12-24 23:28:26+09:00,1738929631724818762,https://x.com/uni_ikura_11/status/1738929631724818762,川島明「(松本人志は)日本一言霊のある方なんで」,,,0.0,0.0,0.0,NEUTRAL,0.33407795,0.312073,0.353849
2023-12-24 23:28:35+09:00,1738929670387876318,https://x.com/A00970383A/status/1738929670387876318,【Ｍ―１】松本人志、最後に登場のモグライダーの不振に爆弾発言「『ジョンソン』も終わっちゃうし…」（スポーツ報知） - Yahoo!ニュース  素人でもわかるツマらなさだった 楽しみにしてただけに残念だ  news.yahoo.co.jp/articles/ea697 …,A00970383A,桂樹,0.0,0.0,0.0,AGAINST,0.3708268,0.29577053,0.33340266
2023-12-24 23:28:50+09:00,1738929731716907381,https://x.com/yama_stay_stay/status/1738929731716907381,令和ロマン初めて観たけど面白かった～まさに納得の優勝。 さや香のネタは？だったけど、一本目から松本人志に「令和ロマンを越えてない」と言い切られたらもう正攻法じゃなくて変化球出すしか無いよな。というかあの発言でもう気持ちが折られてたのでは。,yama_stay_stay,春,0.0,0.0,1.0,NEUTRAL,0.1996811,0.22237597,0.5779429
2023-12-24 23:29:08+09:00,1738929805721239987,https://x.com/Beautiful_sound/status/1738929805721239987,ここまっじで震えました  松本人志が最後の一手なのがもう、映画 ,,,,,,NEUTRAL,0.24236599,0.25492558,0.50270844
2023-12-24 23:29:26+09:00,1738929881118032047,https://x.com/AQT0602/status/1738929881118032047,今年の本戦の最大のインパクトは松本人志がさや香に89点をつけたところだったなー,AQT0602,あくた,0.0,0.0,1.0,NEUTRAL,0.3052922,0.3193351,0.37537274
2023-12-24 23:30:19+09:00,1738930104565424397,https://x.com/teragakidesu/status/1738930104565424397,松本人志が作詞のチキンライスっていう曲、とてもいいですよ 特にM1のクリスマスイブには  ↓ 親孝行って何？って考える でもそれを考えようとすることがもう 親孝行なのかもしれない  子どもの頃たまに家族で外食 いつも頼んでいたのはチキンライス 豪華なもの頼めば二度とつれてきては,teragakidesu,寺垣俊介𝕏ネクスパート法律事務所,2.0,1.0,22.0,NEUTRAL,0.27591446,0.23584934,0.48823628
2023-12-24 23:30:35+09:00,1738930171128992214,https://x.com/muimuiushiroto/status/1738930171128992214,松本人志の採点で納得できたことがあまりないのはさておきとして博多大吉のあのコメントの妙な具体性が漫才しないけど普通に参考になる,muimuiushiroto,ちゃんあざ来年鼻フル,0.0,0.0,4.0,FAVOR,0.27322614,0.3886946,0.33807927
2023-12-24 23:30:41+09:00,1738930197091803404,https://x.com/BOBO_POIPE/status/1738930197091803404,素人目にも的外れな松本人志論のお陰でM-1のTLに耐性をつけることが出来ました！！,BOBO_POIPE,ボボポイぺ,0.0,0.0,1.0,FAVOR,0.28431144,0.38913587,0.32655263
2023-12-24 23:30:50+09:00,1738930236572790914,https://x.com/tundratiger/status/1738930236572790914,ほぼ終電で帰路。一緒にM-1見てた人たちとは「さや香の二本目は“漫才”なのか」「でもさや香の二本目良かった」という声もあって割と三組とも可能性あるんじゃないかって気持ちで結果を見てました。  あと松本人志の点数が適切だったという声が多いけど、我々の間では博多大吉への共感が強かったです。,tundratiger,ルイ,1.0,1.0,6.0,NEUTRAL,0.23853159,0.25891623,0.50255215
2023-12-24 23:30:52+09:00,1738930243585671312,https://x.com/temaemisoitchou/status/1738930243585671312,終ぞ山田邦子さんと松本人志さん以外、ほとんどどちらかに寄せた驚き等々リアクションしてないことに、お立場表明後も、結果判明後さえも審査員としての重責に打ちひしがれてる感isあるよな。。  審査員のみなさん本当にお疲れ様でした！！！！  x.com/80412_/status/ …,temaemisoitchou,味味kaburi(キシカン),0.0,0.0,0.0,NEUTRAL,0.32683095,0.33623564,0.33693334
2023-12-24 23:31:06+09:00,1738930303392235685,https://x.com/sakumomo29/status/1738930303392235685,これも思った！さや香が去年よかっただけに、他の審査員はそれに引っ張られてるかな？と思った。多分さや香を残そうとしてたんじゃないかな？松本人志がそう言ってくれたから基準が統一されたよね。,sakumomo29,さくもも,0.0,0.0,1.0,NEUTRAL,0.24971066,0.2376489,0.5126404
2023-12-24 23:31:23+09:00,1738930375332946217,https://x.com/KanataHoshino2/status/1738930375332946217,松本人志は点数のインフレ化を阻止して令和ロマンを王者に導いたので、お笑い界の日銀総裁。,KanataHoshino2,Kanata,0.0,0.0,0.0,NEUTRAL,0.29119995,0.2521289,0.45667112
2023-12-24 23:31:54+09:00,1738930505297588544,https://x.com/mojiriko/status/1738930505297588544,準決勝はダンビラのアイドルが最高風速だったけど、決勝だと観客が審査員の目を意識して「これは松本人志理解できてるのかな？」みたいな思考が邪魔してウケ量が減ったのかな,mojiriko,国家権力,0.0,0.0,0.0,AGAINST,0.36506093,0.31733245,0.31760666
2023-12-24 23:32:10+09:00,1738930568816161276,https://x.com/jyojijyoji555/status/1738930568816161276,令和ロマンおめでとう  松本人志の審査はグッド！  ,,,,,,FAVOR,0.3008797,0.4054104,0.29370984
2023-12-24 23:32:21+09:00,1738930615549100293,https://x.com/noflyingcircus/status/1738930615549100293,松本人志は、基本的に嫌いなんだけど、クリスマスに、この曲は何度も聴いて、お前はすごいなぁ、、えらいなぁ、って思うことにしてる。、,noflyingcircus,ビリヤニ定食たびる松永大樹,1.0,0.0,1.0,NEUTRAL,0.32002032,0.23437561,0.44560406
2023-12-24 23:32:34+09:00,1738930671509524758,https://x.com/stray_bullet555/status/1738930671509524758,令和ロマンとヤーレンズが3:3で並んだ時の松本人志の驚きが全て,stray_bullet555,くりーん,1.0,0.0,3.0,NEUTRAL,0.27473792,0.30501774,0.42024428
2023-12-24 23:32:55+09:00,1738930758193176904,https://x.com/pray_water/status/1738930758193176904,M-1決勝大好きなので何年に誰が誰に何点入れたとかWikipediaでよく見るんやけど、今年全体的にレベルうーんって感じやなーって思って見てたら、松本人志が最高点93で終わったのが現体制になってから最低点だった。 今までは最高94点(2018年)が最低点。,pray_water,みずきち,0.0,0.0,2.0,NEUTRAL,0.29159176,0.20902978,0.49937838
2023-12-24 23:33:01+09:00,1738930783254131012,https://x.com/aki007fan/status/1738930783254131012,そら、そういう審査になるよ。片方は漫才で今をきづいた人とタレントとしてやってた人では全然考えは違うもん。M―1優勝候補「さや香」の山田邦子と松本人志の大きく割れた採点にネットざわつく「98と89エグい」 ,,,0.0,0.0,0.0,NEUTRAL,0.32105097,0.31603292,0.3629161
2023-12-24 23:33:26+09:00,1738930889118331231,https://x.com/UltomSeven/status/1738930889118331231,令和ロマンに90点をつけてしまったが故に後々の採点が苦しそうな松本人志が面白かった。,UltomSeven,ゼンカイザワ,0.0,0.0,5.0,NEUTRAL,0.26915827,0.27078974,0.460052
2023-12-24 23:35:14+09:00,1738931340702335128,https://x.com/linh99999999912/status/1738931340702335128,"【M－1】松本人志が優勝の令和ロマンに衝撃的な一言を放つ…( さや香   ヤーレンズ     m1グランプリ   エムワン 敗者復活  敗者復活戦 )   #M1 , #松本人志 , #令和ロマン ,  #さや香  ,  #ヤーレンズ ,     #m1グランプリ  ,  #エムワン敗者復活   ,#敗者復活戦  , youtu.be/yfFVRrpHYEY",linh99999999912,FAN-スポーツSports,0.0,0.0,0.0,FAVOR,0.31374314,0.36722955,0.31902725
2023-12-24 23:35:22+09:00,1738931377830318181,https://x.com/ssc_training/status/1738931377830318181,さや香は松本人志に唯一辛い点数をつけられ、山田邦子にボロカスに言われたという事実だけで来年1000万稼げるよ,ssc_training,すんたろう,0.0,0.0,0.0,NEUTRAL,0.29858333,0.27060065,0.43081608
2023-12-24 23:35:40+09:00,1738931451100635352,https://x.com/thefilmykuri/status/1738931451100635352,松本人志の審査はしっかりしてましたね,thefilmykuri,Maut,0.0,0.0,1.0,FAVOR,0.25445798,0.4856398,0.25990224
2023-12-24 23:35:43+09:00,1738931465617080363,https://x.com/noflyingcircus/status/1738931465617080363,浜田雅功のボーカルの方がかなり松本人志の当時の感覚に寄り添ってる感じがしてさすがだなと思う。,noflyingcircus,ビリヤニ定食たびる松永大樹,0.0,0.0,0.0,NEUTRAL,0.3048561,0.24850893,0.44663495
2023-12-24 23:35:48+09:00,1738931484814463043,https://x.com/EFu_eFu_eFu_/status/1738931484814463043,NY大感動で配信遅れてる？と思ったけどそんなことはなく。いつも通り芸人内芸人オタクの屋敷さん、赤ら顔で松本人志に謎提言する嶋佐さんで締め括りにふさわしい安心感ある回でした。今年もありがとうございました。また来年からもニューラジオ配信楽しみにしてます！ ,,,,,,NEUTRAL,0.20270623,0.32783508,0.4694587
2023-12-24 23:36:11+09:00,1738931581371478030,https://x.com/yosidasenpai588/status/1738931581371478030,わーーーー　終わった。吉本興業なんだて。　松本人志も印象悪いね。モモコもタダって言って吉本に金払われとるし。　政治と癒着したお笑い芸人って！　ならヤクザと癒着の方がええわ！,yosidasenpai588,吉田先輩,0.0,1.0,0.0,NEUTRAL,0.23603575,0.24133141,0.52263284
2023-12-24 23:36:54+09:00,1738931760929620287,https://x.com/human_ningenjin/status/1738931760929620287,俺は1st真空ジェシカを1位評価した博多大吉と2位評価した松本人志を信じる,human_ningenjin,ヒューマン,0.0,0.0,4.0,FAVOR,0.28793734,0.36889666,0.34316605
2023-12-24 23:36:54+09:00,1738931762158588125,https://x.com/thefilmykuri/status/1738931762158588125,松本人志、審査の目がすごすぎる。。 紳助抜けた後、プレッシャーはかなりのもんでしょうね、、、,thefilmykuri,Maut,0.0,0.0,1.0,NEUTRAL,0.19735897,0.24725191,0.5553891
2023-12-24 23:37:07+09:00,1738931816860708986,https://x.com/hsm2/status/1738931816860708986,ヤーレンズとマユリカが好きでした！松本人志とは毎年合わない！そろそろ審査員の方に感情移入する世代になってきた感！,hsm2,hsm,0.0,0.0,1.0,NEUTRAL,0.32075468,0.32789907,0.35134628
2023-12-24 23:38:38+09:00,1738932198521413700,https://x.com/FMTOWNS20F/status/1738932198521413700,感覚でやってる海原ともこが審査員って心配やったけど、感じた要素を言葉にしてて悪くない審査員やったな。  ,,,,,,NEUTRAL,0.28878772,0.30894455,0.40226772
2023-12-24 23:39:36+09:00,1738932441803522544,https://x.com/Ivyqpg7JlGL7sTW/status/1738932441803522544,まじで松本人志が天才すぎて 審査凄すぎるってずっと思ってた,Ivyqpg7JlGL7sTW,自分,0.0,0.0,2.0,NEUTRAL,0.31622642,0.30984467,0.3739289
2023-12-24 23:39:43+09:00,1738932469657960778,https://x.com/kiya__na/status/1738932469657960778,どうせ芸人は松本人志の点数にしか興味ないんだから、松本だけ10点刻みで点数つければいい。,kiya__na,きや@SDGs東京,0.0,0.0,1.0,NEUTRAL,0.2620736,0.22552821,0.51239824
2023-12-24 23:40:00+09:00,1738932541090824669,https://x.com/tweetsoku1/status/1738932541090824669,【M-1】優勝候補「さや香」の山田邦子と松本人志の大きく割れた採点にネットざわつく「98と89エグい」  tweetsoku.com/2023/12/24/%e3 …,tweetsoku1,ツイッター速報〜BreakingNews,9.0,3.0,9.0,AGAINST,0.39471623,0.33083677,0.27444696
2023-12-24 23:40:23+09:00,1738932638705189017,https://x.com/yIidF2Hq7TZK0Oa/status/1738932638705189017,さや香の1本目みたいなネタが好きだな。2本目は松本人志の一人ごっつにあてられた人が20年前に作ってそうなネタって感じでしたが……。,yIidF2Hq7TZK0Oa,ねんね,0.0,0.0,0.0,NEUTRAL,0.24039982,0.27154708,0.4880531
2023-12-24 23:41:11+09:00,1738932840849641899,https://x.com/SMILEchiyozechi/status/1738932840849641899,松本人志の点数が1番正確ってのも違うと思うんだよな そもそも令和ロマンに90点つけちゃったのはミスだったんじゃないのって思う そのせいで全体的に点数下げざるを得なかったっぽいし ただその90点に最後まで真摯に向き合って点数つけてたなって素人ながら思ってた,SMILEchiyozechi,スミレ,0.0,0.0,1.0,NEUTRAL,0.32977265,0.28685752,0.3833698
2023-12-24 23:41:33+09:00,1738932933552164981,https://x.com/kamifusen55/status/1738932933552164981,カベポスター  「ポスターじゃなく壁ごと」云々審査の人が言ってたの記憶  松本人志かな?!  えみくじ　は　上沼恵美子ではないことを理解した  ,,,,,,NEUTRAL,0.3359837,0.32006207,0.34395424
2023-12-24 23:42:32+09:00,1738933181708115976,https://x.com/ue02ATF01/status/1738933181708115976,くらげのネタ見てる時に｢ミルクボーイみが深い｣と思ってたボキは松本人志だったってことか,ue02ATF01,うえっく,0.0,0.0,1.0,NEUTRAL,0.26312953,0.27923694,0.4576335
2023-12-24 23:42:57+09:00,1738933283206185281,https://x.com/axlroze6969/status/1738933283206185281,真空ジェシカの掴みの「呪物コレクター」は毎年真空ジェシカに低い点数を出す松本人志への縋り付きだったと思う。,axlroze6969,ロゼ,0.0,0.0,0.0,NEUTRAL,0.27733123,0.29344347,0.42922524
2023-12-24 23:44:38+09:00,1738933706272940104,https://x.com/kawaisoumasan/status/1738933706272940104,そう、松本人志さんは常に正しい。よって和牛は3回優勝したこととする。,kawaisoumasan,杉方,0.0,0.0,0.0,NEUTRAL,0.17507198,0.20529908,0.619629
2023-12-24 23:46:13+09:00,1738934108678766809,https://x.com/PERSONA_narukam/status/1738934108678766809,今年のM-1グランプリ、間違いなく松本人志さんの審査が1番適正〜  という投稿  本家のパクリをしていた投稿が7アカウントいたぜ！（通報したぜぇ〜）  番組、企業の公式投稿もパクリしてますね、貴方の番組ですか？企業公式アカですか？しかも俳優のアカを付けてたので俳優に通知行ってますぜ！,PERSONA_narukam,narukamiゴクオーくん,0.0,0.0,0.0,AGAINST,0.42362988,0.2760385,0.30033165
