timestamp,tweet_id,url,content,user_id,user_name,reply_count,retweet_count,like_count,stance_label,stance_against,stance_favor,stance_neutral
2023-12-27 07:37:35+09:00,1739777507099111909,https://x.com/risa20230209/status/1739777507099111909,全裸の松本人志による超高級ホテルでの「恐怖のゲーム」被害者の告発詳細  rin-news.tokyo/archives/2062,risa20230209,リサ,0.0,32.0,41.0,AGAINST,0.37996718,0.33669782,0.283335
2023-12-27 07:37:40+09:00,1739777527667986895,https://x.com/traffic202311/status/1739777527667986895,全裸の松本人志による超高級ホテルでの「恐怖のゲーム」被害者の告発詳細  rin-news.tokyo/archives/2062,traffic202311,えりか,0.0,0.0,1.0,AGAINST,0.37996718,0.33669782,0.283335
2023-12-27 07:37:55+09:00,1739777588619612551,https://x.com/mioman_shi_3/status/1739777588619612551,《参加女性が続々告発》「全裸の松本人志がいきなりキスしてきて…」「俺の子ども産めや！」1泊30万円の超高級ホテルで行われた「恐怖のゲーム」  大阪万博アンバサダー松本人志 We don't need an expo  ⁦ @bieparis ⁩ ⁦ @BBCWorld ⁩  bunshun.jp/articles/-/681 …,mioman_shi_3,みおまん,0.0,0.0,1.0,AGAINST,0.41806015,0.27754658,0.30439323
2023-12-27 07:38:09+09:00,1739777648660984294,https://x.com/mofu_mofu_2323/status/1739777648660984294,権力持つとオットセイになる男の多いこと。人間だって自覚持とうね。  《呼び出された複数の女性が告発》ダウンタウン・松本人志（60）と恐怖の一夜「俺の子ども産めや！」 | 週刊文春 電子版  bunshun.jp/denshiban/arti …,mofu_mofu_2323,ふもふも,0.0,0.0,0.0,FAVOR,0.30963856,0.34554467,0.3448168
2023-12-27 07:38:17+09:00,1739777682391638306,https://x.com/KurikoMmm8j/status/1739777682391638306,12月24日放送[M-1グランプリ]審査員長を務める等、日本の芸能界トップに君臨するダウンタウン松本人志(60)  その松本が六本木の超高級ホテルのスイートルームにて飲み会開催後輩芸人に女性を集めさせ[ゲーム]と称し~いきなりキスをしたり「俺の子ども産めや!」等と性行為を迫っていたりした事実,KurikoMmm8j,久里子,1.0,0.0,1.0,NEUTRAL,0.2578916,0.2666788,0.47542965
2023-12-27 07:38:19+09:00,1739777691367407851,https://x.com/KurikoMmm8j/status/1739777691367407851,と苦しい胸の内を吐露  社会的強者による性加害が社会問題化する中で…  今年9月に還暦を迎えた松本だが、依然タレントとして最盛期を維持し続け─レギュラー番組「水曜日のダウンタウン」(TBS系)「ダウンタウンDX」(日本テレビ系)「人志松本の酒のツマミになる話」(フジテレビ系)等、計7本を数える,KurikoMmm8j,久里子,2.0,0.0,0.0,NEUTRAL,0.25439915,0.27683026,0.46877056
2023-12-27 07:38:40+09:00,1739777778910982627,https://x.com/kabukabubaby/status/1739777778910982627,これ、どうなんのかね。 フジテレビの姿勢が問われるね。  松本人志、３月いっぱいで『ワイドナショー』卒業 oricon.co.jp/news/2270429/f …,kabukabubaby,ıɥsnɯoʇnqɐʞ,0.0,0.0,0.0,NEUTRAL,0.30768922,0.27269855,0.41961226
2023-12-27 07:38:42+09:00,1739777786901143921,https://x.com/ai_pbz/status/1739777786901143921,【芸能】　ダウンタウン・松本人志との恐怖の一夜を告発する複数の女性が登場！「俺の子ども産めや！」との驚愕の発言とは？  quicksports-news.blog.jp/archives/24122 …,ai_pbz,徳・隆ひちゃん,0.0,0.0,0.0,AGAINST,0.37036622,0.32450756,0.30512625
2023-12-27 07:38:50+09:00,1739777821143392405,https://x.com/tetu33123/status/1739777821143392405,松本人志に衝撃スキャンダル「高級ホテルで性行為強要」告発で現実味を帯びる「電撃引退」の引き金  結婚後も何回もこんな事やってたんだろうな。女性蔑視の極み。 吉本は咎めるどころか彼を守るだろうし、メディアもどうか。スポンサーのモラルを注視したい。  asagei.com/excerpt/294918,tetu33123,イズム,0.0,7.0,11.0,NEUTRAL,0.32814506,0.31625086,0.35560402
2023-12-27 07:38:55+09:00,1739777839636029551,https://x.com/TotalDeepDoku/status/1739777839636029551,,,,,,,NEUTRAL,0.2557792,0.31104654,0.43317425
2023-12-27 07:38:57+09:00,1739777851468222599,https://x.com/yakisobachang/status/1739777851468222599,事務所が握り潰せなくなってるし、リークする手段は多方面にある。過去の夢の国はもう存在しないことを認識して行動しないと。女が悪いんじゃない、リスク管理が甘すぎる。最悪を想定して動かないと。それで松本人志を、ダウンタウンを見れなくなるとしたら、ファンとして腹立つけど本人と周りのせい,yakisobachang,やきそばパン,0.0,0.0,0.0,NEUTRAL,0.32808885,0.29421425,0.37769687
2023-12-27 07:38:58+09:00,1739777852923597264,https://x.com/KurikoMmm8j/status/1739777852923597264,12/26日(火)配信 ,,,0.0,0.0,0.0,NEUTRAL,0.30516523,0.32506198,0.3697728
2023-12-27 07:39:05+09:00,1739777881113522557,https://x.com/SeaandLemon1/status/1739777881113522557,自民党の裏金、キックバックといい、ジャニー喜多川の児童への性的虐待といい、松本人志のレイプへの告発といい、反社会的組織、人物が日本の政治、芸能界を支配してきた事実がヤバい。相当おかしな国になってる。,SeaandLemon1,Sea and Lemon,0.0,0.0,0.0,NEUTRAL,0.2692942,0.23079556,0.49991027
2023-12-27 07:39:07+09:00,1739777890148057141,https://x.com/sushiyamatbyk/status/1739777890148057141,松本人志は全力で擁護して相手の女を叩くのにジャニーズ事務所を叩くってもうそれ普通にダブスタとか以前に頭おかしいから。,·,@sushiyamatbyk,0.0,0.0,0.0,NEUTRAL,0.31490114,0.2239497,0.4611492
2023-12-27 07:40:00+09:00,1739778112433553441,https://x.com/tleFZ8yYJa00sVP/status/1739778112433553441,朝質問４ 松本人志さん、罪を償うべき？,tleFZ8yYJa00sVP,フリーダムトレンド質問、画像質問,0.0,1.0,0.0,FAVOR,0.3419091,0.3500947,0.30799615
2023-12-27 07:40:23+09:00,1739778208806142227,https://x.com/minojimika1/status/1739778208806142227,本当なら松本人志を絶対にもうテレビに出さないで欲しいし、性の番組出すとか言語道断だったんだよ。言動でわかるじゃない。女性を人間だと思ってないのが。,minojimika1,minoji,0.0,0.0,1.0,NEUTRAL,0.23459955,0.22781314,0.5375873
2023-12-27 07:40:30+09:00,1739778238153642175,https://x.com/negu847988091/status/1739778238153642175,松本人志という芸人の芸に笑ったことがない。ほとんど見たこともないが、不愉快。,negu847988091,negu,3.0,1.0,7.0,NEUTRAL,0.20054804,0.24525969,0.5541922
2023-12-27 07:40:33+09:00,1739778250862395565,https://x.com/JUNJI____/status/1739778250862395565,松本人志引退あるな,JUNJI____,うえたけ,1.0,0.0,1.0,NEUTRAL,0.3029445,0.21485408,0.48220146
2023-12-27 07:40:33+09:00,1739778253517382019,https://x.com/doodle3451/status/1739778253517382019,,,,,,,NEUTRAL,0.2557792,0.31104654,0.43317425
2023-12-27 07:40:38+09:00,1739778271779414108,https://x.com/KAPZIjuhlKO8F2K/status/1739778271779414108,文春の松本人志氏の記事みて マリエさんを思い出したのだが 性接待はヨシモトの伝統か？,KAPZIjuhlKO8F2K,まのじ,0.0,0.0,1.0,FAVOR,0.28246683,0.3641057,0.35342744
2023-12-27 07:40:44+09:00,1739778299327627388,https://x.com/FpyWak/status/1739778299327627388,ジャニーさんと知り合い？ それとも松本人志と知り合い？ 言い切る根拠は何？,FpyWak,酒肴,0.0,0.0,1.0,NEUTRAL,0.23069695,0.2901986,0.4791045
2023-12-27 07:40:47+09:00,1739778311566623066,https://x.com/Nebosuke_FFGM/status/1739778311566623066,《呼び出された複数の女性が告発》ダウンタウン・松本人志（60）と恐怖の一夜「俺の子ども産めや！」 ,,,,,,AGAINST,0.38652402,0.29101208,0.32246396
2023-12-27 07:40:50+09:00,1739778324216639982,https://x.com/hanaemon/status/1739778324216639982,週刊文春の松本人志ネタ　どうも嘘くさいけど 別に松本人志さんはTV出演を止めても 普通にYoutubeで話すだけで　ザクザクお金入りますやん　ヒカキンを超えるんじゃないの？ 自分が好きな時に好きなことを話すだけで,hanaemon,NumNum,0.0,0.0,1.0,NEUTRAL,0.2560335,0.26302636,0.48094013
2023-12-27 07:41:04+09:00,1739778383083720970,https://x.com/orange21/status/1739778383083720970,松本人志の記事に対してあまりシリアスな反応をみんなしていないな。なんでだろ。フレンチクルーラーとは違う気がするが。,orange21,人気のアカウント,0.0,0.0,0.0,NEUTRAL,0.23178689,0.23425108,0.533962
2023-12-27 07:41:48+09:00,1739778565431054399,https://x.com/fu_raibox/status/1739778565431054399,松本人志、事実なら終わりだし、終わりにさせなければいけない。,fu_raibox,BAYA,0.0,0.0,1.0,NEUTRAL,0.27083924,0.24239394,0.48676684
2023-12-27 07:41:48+09:00,1739778566030786882,https://x.com/vivadondon/status/1739778566030786882,俺の子供産めや！　が、漫才のネタにされ、引退した松本人志のことを揶揄する健全な時代が来るのかな。,vivadondon,クマラージュ【野党共闘で政権交代を！】,0.0,2.0,6.0,NEUTRAL,0.27057853,0.26223022,0.46719122
2023-12-27 07:42:17+09:00,1739778687263031500,https://x.com/kokikokiya/status/1739778687263031500,松本人志と世界LOVEジャーナル - NHK  nhk.jp/p/love-journal …  2023年10月17日  性加害の松本人志さんが  ＮＨＫの特集番組に出演します。性にまつわる世界のさまざまな話題や悩みについて、松本さんと多様な立場の出演者たちが、楽しくまじめに語り合います,kokikokiya,原発はいますぐ廃止せよ,0.0,1.0,1.0,FAVOR,0.29582974,0.39797708,0.30619314
2023-12-27 07:42:24+09:00,1739778719458414806,https://x.com/blaustern823/status/1739778719458414806,「多分この人めっちゃハラスメントしてる」となんとなく思っていても「そういうもんだ」とフタをしてきた継続的加害行為が、外圧でやっと顕在化して「なぜ放置したんだろう」と一億総反省したばかりやよね  《参加女性が続々告発》「全裸の松本人志がいきなりキスしてきて…」 bunshun.jp/articles/-/681 …,blaustern823,むにょ,0.0,0.0,3.0,AGAINST,0.38412,0.28715417,0.32872587
2023-12-27 07:43:04+09:00,1739778887008292884,https://x.com/dam51730/status/1739778887008292884,ハニートラップやはめられた可能性もある！！ 双方の意見が必須！！ msn.com/ja-jp/news/ent …松本人志に-性加害告発-報道で-スポンサー降板ラッシュ-の危機/ar-AA1m2AzG?ocid=socialshare,dam51730,日本人A551,0.0,0.0,0.0,NEUTRAL,0.32803807,0.297457,0.37450486
2023-12-27 07:43:10+09:00,1739778911045836861,https://x.com/pontpont999/status/1739778911045836861,事実とすればホンマカスやな。 これでようやく松本人志の顔をTVで見ずに済みそうやわ。とりあえず探偵ナイトスクープも降板せえよ。,pontpont999,pontpont999,0.0,1.0,2.0,NEUTRAL,0.21131422,0.20871478,0.57997096
2023-12-27 07:43:41+09:00,1739779040024879173,https://x.com/shiro_myah_/status/1739779040024879173,TVはどこも松本人志のことを扱ってないよね？ いつも“○○の記事では”なんて責任から逃げつつ紹介するのにね,shiro_myah_,ぴんから兄弟拳,0.0,0.0,0.0,NEUTRAL,0.34215617,0.23784798,0.41999584
2023-12-27 07:43:46+09:00,1739779063072596250,https://x.com/shiva_rol_brush/status/1739779063072596250,流石に嘘っぽさが凄いけど。 松本人志敵に回して大丈夫か？,shiva_rol_brush,しば,0.0,0.0,1.0,NEUTRAL,0.23721913,0.2877971,0.47498378
2023-12-27 07:43:49+09:00,1739779073982009536,https://x.com/pzYz62AlsIYE5mL/status/1739779073982009536,松本人志、終了！ グァンタナモに行ってらっしゃい！片道切符ですが。,pzYz62AlsIYE5mL,大村勲,2.0,0.0,0.0,NEUTRAL,0.21549976,0.23486537,0.54963493
2023-12-27 07:43:53+09:00,1739779092806012982,https://x.com/donkomasya/status/1739779092806012982,テレビはやらんのね？松本人志の件。,donkomasya,丼釜しゃあ,0.0,0.0,1.0,NEUTRAL,0.24491143,0.23154788,0.5235406
2023-12-27 07:43:55+09:00,1739779098619347079,https://x.com/altozano435/status/1739779098619347079,１年くらい前だったか、松本人志の言動のことで、 あのお笑いもどきにも慰められてる人もいるから正当だ、みたいな人と言い争いになって、 こいつのペドフィリア発言すらスルーしようとしてた信者ファンがいたなあ。 ブロックしたけど元気かしらｗ news.yahoo.co.jp/articles/fde36 …,altozano435,（ねこプラ）＠ネコの額の庭,0.0,0.0,0.0,NEUTRAL,0.31893748,0.2757317,0.40533078
2023-12-27 07:44:05+09:00,1739779140004552716,https://x.com/TATAKAUarumisan/status/1739779140004552716,おはようございます。 ジャニーズの次は、維新とべったり、性加害者松本人志のいる吉本興業を解体しよう,TATAKAUarumisan,たたかうあるみさん,2.0,9.0,13.0,NEUTRAL,0.31403393,0.30193192,0.3840342
2023-12-27 07:44:14+09:00,1739779181020664186,https://x.com/badger_6666/status/1739779181020664186,松本人志のこれは「三つ子の魂百まで」ってことで使い方あってる？,badger_6666,アナグマ,0.0,1.0,2.0,NEUTRAL,0.34077847,0.26382747,0.3953941
2023-12-27 07:44:23+09:00,1739779216160539030,https://x.com/iety99/status/1739779216160539030,範馬勇次郎（cv.松本人志）,iety99,IETY,2.0,0.0,0.0,NEUTRAL,0.32296735,0.3161944,0.3608382
2023-12-27 07:44:25+09:00,1739779223538262212,https://x.com/tokyoniwa/status/1739779223538262212,あんなにジャニーズ事務所を叩いてた人たちはどこに行ってしまったんだろう。松本人志の性的な加害についてあまりにも静かだ。サントリーの社長から松本人志に対してコメントを出してほしい。ジャニーズをあれだけ批判したことを忘れてしまったのだろうか？誰が日本を支配してるのかわかってしまう。,tokyoniwa,tokyoniwa,0.0,9.0,25.0,NEUTRAL,0.26279485,0.19221953,0.5449856
2023-12-27 07:44:36+09:00,1739779270409613527,https://x.com/tuigeki/status/1739779270409613527,松本人志のやったことを批判する声は意外と多い。 テレビでは持ち上げられていたが、裏側ではとんでもないことをしていた。 年末年始の松本が出ていたテレビ番組はどうなる 売れっ子なのでテレビ局はごまかして放送するのでしょうか。 自民党のパーティー券問題を隠すためのネタではないですよね,tuigeki,おくあき まさお一本気の むかし記者,0.0,3.0,3.0,NEUTRAL,0.30057228,0.26770422,0.43172348
2023-12-27 07:44:38+09:00,1739779280501104822,https://x.com/TAKESHiD_25/status/1739779280501104822,ジャニーズの時にこれからは忖度しないと言っていたテレビ局 また吉本興業に忖度して松本人志のレイプ事件報じず ひとつも変わってない,TAKESHiD_25,タケシ・ジ・エンド,0.0,0.0,5.0,AGAINST,0.4308483,0.235728,0.33342364
2023-12-27 07:44:41+09:00,1739779292119363602,https://x.com/don_pre_bass/status/1739779292119363602,「松本人志と世界LOVEジャーナル」OA直前特番｜SRHR視点で語る懸念点・OA時のチェックポイント・抗議署名発信チームへのインタビュー（10/...  youtu.be/7PMSx_bhfqg?si …,don_pre_bass,don,0.0,0.0,0.0,AGAINST,0.3940493,0.32377622,0.2821746
2023-12-27 07:44:43+09:00,1739779300570886506,https://x.com/satoshikoian/status/1739779300570886506,自民党の裏金の話もドリル優子の新たな問題も井上尚弥の勝利も注目しなきゃいけないのだけど松本人志に全て持ってかれてる、ダウンタウンで育った世代,satoshikoian,3104(鯉),0.0,0.0,0.0,NEUTRAL,0.34575704,0.2823961,0.37184682
2023-12-27 07:44:49+09:00,1739779324990144903,https://x.com/yu_kaizyu/status/1739779324990144903,松本人志さん本当ですか…？,yu_kaizyu,うりうり｜Xの住民,0.0,0.0,1.0,NEUTRAL,0.2968449,0.3334703,0.36968473
2023-12-27 07:45:37+09:00,1739779529210753509,https://x.com/shiparaku/status/1739779529210753509,（松本人志も何が面白いのか昔からほんっとにわからん。そして、坂本龍一が一緒に仕事したのを悔やんでいたのもわかる。）,shiparaku,ayam,0.0,1.0,0.0,NEUTRAL,0.28175405,0.23267779,0.4855682
2023-12-27 07:45:51+09:00,1739779587775877480,https://x.com/sakananamat/status/1739779587775877480,で、今朝はテレビで松本人志のやつやった？,sakananamat,さかな,0.0,0.0,0.0,NEUTRAL,0.30355164,0.2773794,0.4190689
2023-12-27 07:46:04+09:00,1739779639843926270,https://x.com/doodle3451/status/1739779639843926270,今回の松本人志報道に対して、「もし事実だとしたら、そりゃあまあ良くはないけど、芸人なんだしハメ外すくらいいいじゃないかよ、な」という旨の擁護はほとんどなかったな。,doodle3451,Kunja,1.0,1.0,0.0,NEUTRAL,0.26855153,0.24151844,0.48993006
2023-12-27 07:46:10+09:00,1739779665362026791,https://x.com/wFVARRWfNwXKxvd/status/1739779665362026791,な、なんか松本人志に何かあったみたいね 文春砲かぁ、ニュースにもなってる、、、 どうなるのかな、、 ダウンタウン大好きでごっつも何なら4時ですよーだも好き、真実だとしたらね 浜田の不祥事もあったけどまっちゃんがカバーした時もあったし、、 あ研究家みて元気出すわ,wFVARRWfNwXKxvd,ささき　ゲームが好きなパパ,0.0,2.0,30.0,NEUTRAL,0.25098786,0.20981961,0.5391925
2023-12-27 07:46:11+09:00,1739779670126764140,https://x.com/marumixi/status/1739779670126764140,松本人志氏というか、ダウンタウンの悪行はとある漫画家さんがエロ漫画でネタにしていたからな。逃げ道、あるかな。(;^_^A,marumixi,maru@mixi,0.0,0.0,0.0,NEUTRAL,0.21670419,0.28112787,0.5021679
2023-12-27 07:46:37+09:00,1739779778524139978,https://x.com/Alzyl_Hany/status/1739779778524139978,広告 「神は気温を 151 度まで上げるでしょう」2023 年 10 月 20 日  堀越先生/親の遺体/週刊文春 東リベ/ジャニーズ/厚生年金/エクソシスト/福袋のフリーレン/オフサイド/仕事納め/松本人志／コールドムーン／最後の満月／ブンブブーン／浅草仲見世／吉本興業／寒天発祥の日,Alzyl_Hany,هاني الزيلعي,3.0,17.0,31.0,NEUTRAL,0.3384126,0.31092393,0.35066348
2023-12-27 07:47:01+09:00,1739779881653641523,https://x.com/4qwa12/status/1739779881653641523,松本人志のためにテレビあるんともちゃうからね 松本人志のやつ水ダウの企画にしか見えないのダメや 文春の松本人志報道........ギャハハ（笑）,4qwa12,Deem,1.0,0.0,2.0,AGAINST,0.34582806,0.33204752,0.32212442
2023-12-27 07:47:15+09:00,1739779939652845644,https://x.com/meka456SROT/status/1739779939652845644,関連質問 松本人志　なぜ金髪にした？ 松本人志、なぜ坊主にした？ が、じわじわくる ,,,,,,NEUTRAL,0.27915338,0.28270927,0.43813738
2023-12-27 07:47:15+09:00,1739779939778412727,https://x.com/jdhvcdgukbgfwon/status/1739779939778412727,松ちゃんが女遊びをしようと家族に迷惑かけようと私にはまったく関係ないので、今後も番組で楽しませて欲しい。  《呼び出された複数の女性が告発》ダウンタウン・松本人志（60）と恐怖の一夜「俺の子ども産めや！」 ,,,,,,NEUTRAL,0.34720033,0.2706654,0.3821343
2023-12-27 07:47:20+09:00,1739779957638017521,https://x.com/kanryucanada/status/1739779957638017521,これからもお笑い見たいから、松本人志は引いてほしい。,kanryucanada,kanryu家出日本人,0.0,1.0,0.0,NEUTRAL,0.25065964,0.24111442,0.5082259
2023-12-27 07:47:24+09:00,1739779974717149617,https://x.com/kondohi/status/1739779974717149617,なるほど、この文春砲が炸裂でしたか ,,,,,,NEUTRAL,0.3474606,0.30255988,0.34997955
2023-12-27 07:47:48+09:00,1739780075833426300,https://x.com/tetu33123/status/1739780075833426300,《参加女性が続々告発》「全裸の松本人志がいきなりキスしてきて…」「俺の子ども産めや！」1泊30万円の超高級ホテルで行われた「恐怖のゲーム」 | 文春オンライン  どんな権力にもアタックする文春は無双のメディアだな。  bunshun.jp/articles/-/681 …,tetu33123,イズム,0.0,2.0,6.0,AGAINST,0.38808227,0.35301825,0.2588995
2023-12-27 07:47:49+09:00,1739780081810375072,https://x.com/matsueri1/status/1739780081810375072,松本人志ｻﾝ 話題のすいようび 言った方はすぐ忘れ 言われた方は忘れない  ※気をつけたい ,,,,,,NEUTRAL,0.33464104,0.31723678,0.34812218
2023-12-27 07:49:25+09:00,1739780484291584090,https://x.com/lions28461130/status/1739780484291584090,山川穂高も松本人志も 人間失格なのよ 日本での性的犯罪の認識が甘すぎるからあとを立たない,lions28461130,リム王,0.0,0.0,1.0,AGAINST,0.47604305,0.19903375,0.32492313
2023-12-27 07:49:42+09:00,1739780555443691528,https://x.com/M92GA/status/1739780555443691528,批判するのは松本人志氏がコメントしてからで良く無い？最近やたらに片側の意見だけ盲信して弾糾するの多くない？,M92GA,🅝🅐🅝🅐●🅦🅘🅒🅚,0.0,0.0,2.0,AGAINST,0.4091068,0.21625534,0.37463793
2023-12-27 07:50:13+09:00,1739780683927789635,https://x.com/tsunenimaemuki/status/1739780683927789635,ジャニーズと違って吉本興業は政府とズブズブだから正されるのか大丈夫かしらね。  《参加女性が続々告発》「全裸の松本人志がいきなりキスしてきて…」「俺の子ども産めや！」1泊30万円の超高級ホテルで行われた「恐怖のゲーム」  bunshun.jp/articles/-/681 … ,,,,,,AGAINST,0.4120557,0.28285018,0.30509415
2023-12-27 07:50:18+09:00,1739780707445350437,https://x.com/kurobey/status/1739780707445350437,朝っぱらからradikoで驚いた。  ,,,,,,NEUTRAL,0.1789139,0.33380547,0.4872806
2023-12-27 07:50:37+09:00,1739780784830177646,https://x.com/fusasippona1/status/1739780784830177646,松本人志の「ホステスさんに税金は払いたくない」発言で議論白熱！　「職業差別」「ホステスさんは高所得者」 (2020年4月6日) - エキサイトニュース  excite.co.jp/news/article/C …,fusasippona1,とまはぼちぼち,0.0,0.0,1.0,AGAINST,0.3542481,0.30760628,0.3381456
2023-12-27 07:50:43+09:00,1739780810495123833,https://x.com/inuunaaaa/status/1739780810495123833,松本人志は逃げ切れなかったんだな、となる。それにしても多分M1で1年で一番リアルタイムで松本人志を見る人間が多いであろう後に、抜群に嫌悪感を抱かせる、でも購買者数は超増えそうな内容で攻めてくるの強い。,inuunaaaa,うた,0.0,0.0,3.0,NEUTRAL,0.26676697,0.19546165,0.5377714
2023-12-27 07:50:47+09:00,1739780827494662563,https://x.com/Flachhugel_milk/status/1739780827494662563,前から嫌いだったけどやっぱりワタシの感覚正しかったんやな〜松本人志嫌い。,Flachhugel_milk,真夏日和 Flachhügel,0.0,0.0,2.0,NEUTRAL,0.2763359,0.24499021,0.4786739
2023-12-27 07:50:53+09:00,1739780851351814255,https://x.com/mami_tanaka/status/1739780851351814255,松本人志とか山口敬之とかが安倍晋三と懇意だった。,mami_tanaka,Mami Tanaka,0.0,2.0,6.0,NEUTRAL,0.2864014,0.22143431,0.4921643
2023-12-27 07:50:56+09:00,1739780863230144751,https://x.com/i3fSzkgtzNMxgLG/status/1739780863230144751,【悲報】松本人志さん文春砲による性加害報道。。。  2020年にすでにガルちゃんで的確に暴露されていた、、、  ,,,,,,NEUTRAL,0.19629769,0.27351213,0.53019017
2023-12-27 07:50:57+09:00,1739780868917576022,https://x.com/yakiginnan13/status/1739780868917576022,松本人志って、お笑い界やテレビ村では王様の如く崇められて、薄ら寒い乾いた笑いを量産してましたもんね ほんとあらゆる既得権益をいっかいブッ壊す必要性を感じています,yakiginnan13,焼銀杏 〜ロスジェネの騎士〜,1.0,0.0,1.0,FAVOR,0.32415095,0.3569326,0.31891647
2023-12-27 07:51:02+09:00,1739780890677641257,https://x.com/chibutabi_x/status/1739780890677641257,《参加女性が続々告発》「全裸の松本人志がいきなりキスしてきて…」「俺の子ども産めや！」1泊30万円の超高級ホテルで行われた「恐怖のゲーム」（文春オンライン）  ショックな朝を迎えております  news.yahoo.co.jp/articles/fde36 …,chibutabi_x,「あるオンナのチブ旅」byチブ夫,0.0,0.0,0.0,AGAINST,0.3789091,0.30911678,0.3119741
2023-12-27 07:51:10+09:00,1739780924559257707,https://x.com/Ji1KxN15VC85UPF/status/1739780924559257707,ジャニーズの時はスポンサー動いたけど、松本人志の時は動かないんか？,Ji1KxN15VC85UPF,メメント・モリ,0.0,0.0,0.0,AGAINST,0.4142239,0.24111594,0.34466016
