timestamp,tweet_id,url,content,user_id,user_name,reply_count,retweet_count,like_count,stance_label,stance_against,stance_favor,stance_neutral
2023-12-28 08:29:16+09:00,1740152899114881099,https://x.com/usohoso/status/1740152899114881099,何かあったときのネタの話。  甘利明金銭授受問題＞清原和博 桜を見る会問題＞沢尻エリカ 安倍派裏金問題＞松本人志  うーむ,usohoso,USO放送（24時間操業中）,1.0,0.0,2.0,NEUTRAL,0.296883,0.30277973,0.40033728
2023-12-28 08:29:29+09:00,1740152954588627313,https://x.com/hellmelich/status/1740152954588627313,松本人志の文春砲を見て事実か事実無根かはわからないけど何故か 「ガキの腰使いやあらへんで」って言葉が真っ先に浮かんでしまった,hellmelich,ゆっくり武器図鑑,0.0,0.0,5.0,NEUTRAL,0.30418593,0.2808826,0.41493154
2023-12-28 08:29:37+09:00,1740152988310892864,https://x.com/8mkPkSr46Ti5uag/status/1740152988310892864,"""スピードワゴン小沢一敬の所属事務所「お話しすることはございません」松本人志に関する声明受け""  大手芸能事務所ホリプログループホリプロコム所属､スピードワゴン小沢一敬。 週刊文春では松本人志さんとともに､性加害当事者との報道。  隠蔽体質芸能界の闇です。 nikkansports.com/entertainment/ …",8mkPkSr46Ti5uag,kazuminmin,0.0,6.0,10.0,FAVOR,0.281779,0.37130865,0.34691232
2023-12-28 08:29:40+09:00,1740153001334231401,https://x.com/nashimurakasm2/status/1740153001334231401,記者会見は個人の判断。 日本は法治国家。 松本人志が刑事裁判の法廷で無実になったら望月は謝罪するんだよね。 それくらいの覚悟はあるよね。 単なる傍観者なら言われるがままに受け入れる大衆と同じだからジャーナリストを辞めるんだよね。,nashimurakasm2,優しい架純んてぃ,2.0,11.0,31.0,NEUTRAL,0.2515921,0.25261557,0.49579233
2023-12-28 08:30:00+09:00,1740153085874540755,https://x.com/mqbpFMHHKzf51Bc/status/1740153085874540755,サーヤありがとう 松本人志、気持ち悪い,mqbpFMHHKzf51Bc,ごんたろうかな,0.0,0.0,0.0,AGAINST,0.40008497,0.2036013,0.3963137
2023-12-28 08:30:02+09:00,1740153093994750362,https://x.com/start20221218/status/1740153093994750362,【安住紳一郎に続くのは？？‥松本人志 案件】  吉本興業とズブズブの宮根誠司・羽鳥慎一？ 谷原章介？石井亮二？  次は、どこのワイドショーが取り上げる？  ,,,,,,NEUTRAL,0.30484688,0.331458,0.36369509
2023-12-28 08:30:13+09:00,1740153139125538992,https://x.com/ck882538/status/1740153139125538992,【松本人志・飲み会】複数女性を呼び出した後輩芸人は誰？スピードワゴン小沢?! | ひなたブログ  nora-ningen.com/wagon/,ck882538,史爺,0.0,0.0,0.0,NEUTRAL,0.29574347,0.35060978,0.35364679
2023-12-28 08:30:18+09:00,1740153158511513917,https://x.com/newseicho/status/1740153158511513917,もみ消しはアカンで 吉本興業 松本人志,newseicho,サセナッフ （Sassenach）,0.0,0.0,0.0,AGAINST,0.3670916,0.30042884,0.3324796
2023-12-28 08:30:18+09:00,1740153159933456791,https://x.com/590Palmtree/status/1740153159933456791,松本人志への文春砲にオリラジ中田敦彦が“意味深”反応？ YouTubeでの過去の「提言」再注目  msn.com/ja-jp/news/ent …,590Palmtree,palmtree-590,0.0,0.0,0.0,FAVOR,0.34384534,0.36950672,0.28664798
2023-12-28 08:30:19+09:00,1740153165075689948,https://x.com/Otabe_kun/status/1740153165075689948,ジャニーズの性加害問題で反省したはずのテレビ局が松本人志の件を完全スルー。 やっぱりあれはポーズだけだったね。  ,,,,,,NEUTRAL,0.2661814,0.24543792,0.48838067
2023-12-28 08:30:29+09:00,1740153205055430996,https://x.com/MSNJapan/status/1740153205055430996,「こっち！こっち！」自らタクシー停め…「性加害報道」松本人志「一般女性とノリノリ夜遊び」衝撃現場 msft.it/6017ieQlv,MSNJapan,MSN Japan,0.0,0.0,0.0,NEUTRAL,0.33562288,0.29828858,0.3660886
2023-12-28 08:30:39+09:00,1740153247980253643,https://x.com/hexagon_4clover/status/1740153247980253643,松本人志のやつ、一番信憑性がない部分は、「松本人志がこんなテンプレで面白みのない言葉で女を口説くわけないだろ」なんだよなぁ,hexagon_4clover,へきさごん,0.0,0.0,0.0,NEUTRAL,0.32421088,0.24201198,0.43377715
2023-12-28 08:30:46+09:00,1740153278082818454,https://x.com/OKNao03/status/1740153278082818454,林真理子や日大おちょくった みたいに 松本人志ネタにしてみろや モーニングショー,OKNao03,Nao,0.0,0.0,2.0,AGAINST,0.4051547,0.23091939,0.3639259
2023-12-28 08:31:02+09:00,1740153344268853535,https://x.com/honoka0818/status/1740153344268853535,松本人志の番組は取り巻きを見て楽しむものだと思ってましたw 本人がやったNHKのコントは酷かったですw,honoka0818,みゆき@花粉症キツめ,1.0,0.0,0.0,NEUTRAL,0.2703132,0.30423263,0.42545414
2023-12-28 08:31:09+09:00,1740153372320432407,https://x.com/CpDHNXsJtn30D7j/status/1740153372320432407,これもう半分松本人志擁護だろ,CpDHNXsJtn30D7j,れん,0.0,0.0,0.0,NEUTRAL,0.362951,0.20094135,0.43610764
2023-12-28 08:31:11+09:00,1740153383682736327,https://x.com/plutoatom/status/1740153383682736327,松本人志さん報道めぐり「当該事実は一切ない」吉本が抗議【モーサテ】（2023年12月28日）  youtu.be/k4GSH3pMGjI?si …  @YouTube より,plutoatom,plutoatom,0.0,0.0,1.0,NEUTRAL,0.25497583,0.32436267,0.4206615
2023-12-28 08:31:19+09:00,1740153417295958310,https://x.com/waterwoodnewsxx/status/1740153417295958310,松本人志の芸能界引退は２年前に予言されているね。  【激震】松本人志が２年で芸能界引退へ、霊視系ユーチューバーの予言的中【浜田は？】 - 人生は上々だ。  waterwood.jp/entry/20230225 …,waterwoodnewsxx,SAIHATE_FX,0.0,2.0,0.0,NEUTRAL,0.23724513,0.36633617,0.3964187
2023-12-28 08:31:23+09:00,1740153433095897192,https://x.com/Makot1238965/status/1740153433095897192,松本人志さん 俺は週刊誌の報道事実じゃないと 俺松ちゃんと生年月日同じだ 頑張って戦って下さい応援してます,Makot1238965,星G,1.0,0.0,0.0,NEUTRAL,0.27560538,0.23742972,0.48696488
2023-12-28 08:31:24+09:00,1740153436568793195,https://x.com/2002United/status/1740153436568793195,松本人志はなんかの番組に記事書いたやつと告発した女呼んで話し合ってほしい。まぁ後者2人は来ない゛,2002United,てぃーちゃー。,0.0,0.0,0.0,NEUTRAL,0.2243363,0.22068861,0.55497515
2023-12-28 08:31:27+09:00,1740153449520730444,https://x.com/Loneliness_NEET/status/1740153449520730444,松本人志完全に終わったな 文春砲くらってんじゃん 今や顔面がヘドロみたいで身体も汚ねえしお笑いのセンスもゼロになって、モテないからって 小沢の主催するパーティーで地位を利用してしか 若い女抱けないとか情けない,Loneliness_NEET,田中田,0.0,0.0,2.0,AGAINST,0.43305278,0.21570367,0.3512435
2023-12-28 08:31:36+09:00,1740153488213213320,https://x.com/tatara0220/status/1740153488213213320,DNA検査結果、嫁との子は僕との子供では無かった。 流れてきたので深い話はワカランが結婚前に整形 していて、その話しを了承していないと、どっち にも顔似てなくて、誰の子？みたいになりそう。 伝えないと詐欺っちゃ詐欺だわなー。 松本人志。お金あるだろうし一夫多妻制度の 国へ移住したらいい,tatara0220,tatara0220,0.0,0.0,0.0,NEUTRAL,0.21880795,0.23655206,0.54464
2023-12-28 08:31:53+09:00,1740153556722954606,https://x.com/Utani_Katsuyuki/status/1740153556722954606,松本人志さんの問題は、そんなことではなく、才能が枯渇したのか面白くないこととか、映画を撮ってもつまらないから、撮らせてもらえないとか、全盛期が終わったことだろう。紳助さんとかは、引退まで面白かったのに。,Utani_Katsuyuki,宇谷勝幸,0.0,0.0,0.0,NEUTRAL,0.27096948,0.20207955,0.52695096
2023-12-28 08:31:59+09:00,1740153583738425701,https://x.com/mii_neko48X/status/1740153583738425701,年末は芸能関係、DJ社長や松本人志さんの話題で大荒れですね。Xでも。私も結構大荒れだからポストしたいぃ。まだちょっと迷ってる。仕事納めはいつまでかな。それとは別に年末までにやり終えたいこと幾つかあるので朝1から動いていきマス!!お仕事の方行ってらっしゃい⟡.·*. おはみぃ,mii_neko48X,みぃねこ ファッションスタイリスト◇言葉で想いを伝える人,6.0,6.0,84.0,NEUTRAL,0.22864355,0.30478406,0.4665723
2023-12-28 08:32:20+09:00,1740153673731477585,https://x.com/maipuyyz/status/1740153673731477585,ガチで松本人志と吉本興業潰して欲しい あんなもん芸能でも何でも無い,maipuyyz,ボネ次郎アナログ再生担当,0.0,0.0,0.0,AGAINST,0.4478712,0.17350452,0.37862426
2023-12-28 08:32:31+09:00,1740153716148429010,https://x.com/NgztxZrFXG78zQi/status/1740153716148429010,警察に言うか週刊誌に言うか という手段の議論にリソースを割く必要性を私は感じない  一番の関心はテレビ各局の報道がジャニーズ問題からどう変わったか  （松本人志さんの件は事実か分からないが）,NgztxZrFXG78zQi,Ｚ世代の代表,0.0,0.0,0.0,AGAINST,0.3759272,0.3269124,0.29716036
2023-12-28 08:32:31+09:00,1740153717691957723,https://x.com/waterwoodnewsxx/status/1740153717691957723,松本人志は性欲落ちてないらしいからね。  ＧＡＣＫＴが「性欲異常だった」と告白、松本人志は「還暦になっても実はそんなに変わってない」 - 人生は上々だ。  waterwood.jp/entry/20231125 …,waterwoodnewsxx,SAIHATE_FX,0.0,1.0,0.0,NEUTRAL,0.31269836,0.29193893,0.3953627
2023-12-28 08:32:33+09:00,1740153726256746900,https://x.com/fNhB6PQ0DwdbD7k/status/1740153726256746900,興行界はかつて暴力団と密着していたが、いまや政治権力と密着するようになっている。ヤクザより政治家の方が甘い汁を吸わせてくれるのかも知れん。  松本人志「俺の子ども産め！」報道に吉本興業が法的措置示唆と…メディア完全沈黙のワケ(日刊ゲンダイDIGITAL) news.yahoo.co.jp/articles/1bd2a …,fNhB6PQ0DwdbD7k,爺庵,0.0,0.0,1.0,NEUTRAL,0.28769287,0.34886283,0.36344433
2023-12-28 08:32:35+09:00,1740153733881966645,https://x.com/Texas_Special/status/1740153733881966645,「こっち！こっち！」自らタクシー停め…「性加害報道」松本人志「一般女性とノリノリ夜遊び」衝撃現場（FRIDAY）  news.yahoo.co.jp/articles/5a4bd …,Texas_Special,公爵,0.0,0.0,0.0,AGAINST,0.35438338,0.3146834,0.33093324
2023-12-28 08:32:40+09:00,1740153753951756648,https://x.com/Makot1238965/status/1740153753951756648,俺は松本人志さんの事信じてます 松ちゃん頑張って下さい 応援してる,Makot1238965,星G,0.0,0.0,0.0,NEUTRAL,0.3092579,0.248946,0.44179606
2023-12-28 08:32:51+09:00,1740153799900328290,https://x.com/oddjobb_tohgoh/status/1740153799900328290,松本人志くらいの大物になれば女性がたくさんいる飲み会なんて数限りなくあってただろうし、その場に喜んで行く女性もいるだろう  酒も入ればその場のノリで色んなことも言ったり触ったりとかはあっただろうが、細いところまではそりゃ憶えてないさ  「記憶にない」はそういうことだ,oddjobb_tohgoh,サカタ・タナカ,1.0,0.0,2.0,NEUTRAL,0.31769067,0.22367068,0.4586387
2023-12-28 08:32:57+09:00,1740153827171721369,https://x.com/FgeTaoist/status/1740153827171721369,松本人志は面白くない、をこのタイミングで言うのはどうかな  好きじゃない、は分かる 俺も好きじゃない ただ、才能は認めざるを得ないんじゃないかな  芸（師弟で継承できるもの）ではなく才（個人に先天的に属するもの）だとは思うので、芸人というよりは才人＝タレントだとも思うけど,FgeTaoist,fge taoist,0.0,0.0,0.0,NEUTRAL,0.28886494,0.2728177,0.43831736
2023-12-28 08:33:31+09:00,1740153967727059297,https://x.com/titl_hrh/status/1740153967727059297,Xの雑魚オスが松本人志を庇ってる様子見るとホモソーシャルって強者男性にとっては気持ちよさそうやなーと思う,titl_hrh,楽しいお休み,0.0,0.0,2.0,NEUTRAL,0.31700373,0.23809272,0.44490358
2023-12-28 08:33:43+09:00,1740154017853165989,https://x.com/AICatchNews/status/1740154017853165989,松本人志の報道に吉本興業が法的措置を検討！ ai-x-catch.news/src/5fa787e0-c … ,,,,,,AGAINST,0.35522178,0.29226902,0.35250923
2023-12-28 08:33:55+09:00,1740154069136838774,https://x.com/democracymonger/status/1740154069136838774,文春が隠し玉の証拠の記事を小出しにするのはいつものこと。  話題に出た時点で松本人志は終わってる。,democracymonger,民主主義の狂信者,0.0,0.0,1.0,NEUTRAL,0.24963398,0.24162574,0.5087403
2023-12-28 08:34:00+09:00,1740154090154561859,https://x.com/penpal_pfm/status/1740154090154561859,しかし、、、とくべつ松本人志が好きってわけでもないし、むしろあんまり好きじゃないけど、言い分も聞いてない段階で叩いてる人らは、福田村事件で真っ先に手を出した者レベルだよな。いにしえの日本村感覚。文春はもはや権力だし,penpal_pfm,秋月朗芳＠UFO研究家,1.0,2.0,6.0,NEUTRAL,0.25759402,0.25134978,0.4910562
2023-12-28 08:34:05+09:00,1740154111994294646,https://x.com/OKNao03/status/1740154111994294646,裁判して白黒つけるべきですよ 太田光の日大裏口疑惑裁判みたいに 松本人志が性加害かどうか,OKNao03,Nao,1.0,0.0,2.0,AGAINST,0.41961247,0.29711202,0.28327549
2023-12-28 08:34:13+09:00,1740154145947230472,https://x.com/myoyamada7/status/1740154145947230472,,,,,,,NEUTRAL,0.2557792,0.31104654,0.43317425
2023-12-28 08:34:19+09:00,1740154171809280132,https://x.com/kiyora265/status/1740154171809280132,ジャニーズ事務所の場合、ジャニー喜多川は亡くなって証言は得られなかったけれど、松本人志は生きているから証言を得られますよね。  刑事罰としては時効でも民事で証言して事実認定してもらえばいいと思う。  加害者も被害者も生きている。  吉本興業はスマイルアップのようになるのかな。,kiyora265,浄,1.0,0.0,1.0,NEUTRAL,0.257702,0.23747297,0.50482506
2023-12-28 08:34:30+09:00,1740154216688263380,https://x.com/OwucJVDxppuRUw9/status/1740154216688263380,松本人志みたいな下品漢、とっとと消えろ。,OwucJVDxppuRUw9,べーすけ,0.0,3.0,0.0,NEUTRAL,0.31426227,0.21484695,0.47089082
2023-12-28 08:34:36+09:00,1740154243779317854,https://x.com/oT0SrQFwIQpwllq/status/1740154243779317854,今、騒がれてるダウンタウンの松本人志さんですが、3年前の「人志松本の酒のツマミになる話」で、不倫報道が出た際のメディア対応の方法を質問され、松本さんは「全部その通りです」って言うと豪語しています。これをやられたら、「文春側はもうやりようがないと思う」のだそうです。,oT0SrQFwIQpwllq,ルビー・ミッドナイト,0.0,3.0,5.0,NEUTRAL,0.26425287,0.29001057,0.44573656
2023-12-28 08:34:41+09:00,1740154262515298340,https://x.com/moEXTRAblog/status/1740154262515298340,ダウンタウン松本人志の性的スキャンダルを吉本興業が否定　文春に法的措置を検討 - 記事詳細｜Infoseekニュース  news.infoseek.co.jp/article/tospo_ …,moEXTRAblog,萌えきすとらブログ（公式）raynos.exblog.jp,0.0,0.0,1.0,AGAINST,0.34730816,0.32679594,0.3258959
2023-12-28 08:34:42+09:00,1740154265824645124,https://x.com/x90suzuki/status/1740154265824645124,2時前にテレビでたまに見るなあ。 SASUKEで松本人志と長淵剛の一騎打ちとかやれば面白いかも。,x90suzuki,シロさんa.k.a.えりん　スクショ転載禁止,0.0,2.0,2.0,NEUTRAL,0.24638037,0.22906488,0.5245548
2023-12-28 08:34:44+09:00,1740154276360659221,https://x.com/Q9EfncIHx03eBkR/status/1740154276360659221,冗談でもこの発想が出てくる事自体が良い人だと思う 松本人志には絶対出来ないだろ  t.co/dUYo17alXA,Q9EfncIHx03eBkR,ハムめろん,0.0,0.0,0.0,NEUTRAL,0.31115055,0.3407379,0.34811154
2023-12-28 08:35:11+09:00,1740154388801593623,https://x.com/kawazoemakoto/status/1740154388801593623,松本人志「俺の子ども産め！」報道に吉本興業が法的措置示唆と…メディア完全沈黙のワケ  nikkan-gendai.com/articles/view/ … ,,,,,,AGAINST,0.38016802,0.2744795,0.34535253
2023-12-28 08:35:19+09:00,1740154423975010503,https://x.com/ribonbambini/status/1740154423975010503,松本人志さんの性加害を女性が証言。週刊文春の報道を吉本は否定（ハフポスト日本版）  news.yahoo.co.jp/articles/dd185 …,ribonbambini,ribon,0.0,0.0,1.0,NEUTRAL,0.3163595,0.30380988,0.37983063
2023-12-28 08:35:21+09:00,1740154431038275839,https://x.com/ribonbambini/status/1740154431038275839,松本人志に性加害疑惑報道「信じたくない」SNS激震、事務所は全面否定＆本人沈黙…テレビ各局に報道姿勢を聞いた（SmartFLASH）  news.yahoo.co.jp/articles/e6c5b …,ribonbambini,ribon,0.0,0.0,1.0,NEUTRAL,0.35444534,0.29051024,0.35504442
2023-12-28 08:35:22+09:00,1740154433458290951,https://x.com/mtrikr/status/1740154433458290951,ジャニーズも吉本も、年貢の納め時なんだろうね  ジャニー喜多川さんは許されなかったけど松本人志さんは許されるのかな？ジャニオタによるセカンドレイプもお笑いファンによるセカンドレイプも同等に許されないよね  なんで毎回被害者が叩かれるんですかね,mtrikr,hachi,1.0,0.0,4.0,AGAINST,0.40609765,0.24219817,0.35170415
2023-12-28 08:35:26+09:00,1740154453481918815,https://x.com/tsubakiharayuya/status/1740154453481918815,ジャニー被害者のようにこれから続々と被害者が出てくるかもね。松本氏が引退か‥ 浜田は大丈夫か？  【文春砲】 松本人志さん芸能界引退へ。複数女性の告発が相当やばい事になりそう・・・ : あじあのネタ帳  asianoneta.blog.jp/61113611,tsubakiharayuya,椿原 悠也・高市総理支持、自民不支持,0.0,0.0,2.0,FAVOR,0.3396152,0.36714366,0.2932411
2023-12-28 08:35:27+09:00,1740154454866059438,https://x.com/plutoatom/status/1740154454866059438,懲役太郎チャンネル 松本人志に文春砲「〇犯罪！？」今後どうなる！？  youtu.be/jAdibb9_UB0?si …  @YouTube より,plutoatom,plutoatom,0.0,0.0,3.0,NEUTRAL,0.24334945,0.30224338,0.45440716
2023-12-28 08:35:28+09:00,1740154461212020808,https://x.com/FFMatudo/status/1740154461212020808,性暴力の自由戦士が現れた。松本人志を追放することは、中国のようになると主張した。 ご都合種で人権を語るな！,FFMatudo,FFMatudo,1.0,0.0,3.0,AGAINST,0.46390676,0.22352068,0.31257254
2023-12-28 08:35:34+09:00,1740154485127917746,https://x.com/hayanetea/status/1740154485127917746,このタイミングに人志松本に出るのゲストによっては緊急関係者協議案件になりそうだけど林檎さんだったら炎上し返しリスクすらありそうだからなんかよかったな(よかったのか),hayanetea,はやね,0.0,0.0,0.0,NEUTRAL,0.33750153,0.27877113,0.38372734
2023-12-28 08:35:34+09:00,1740154485438283993,https://x.com/osi_yo2010/status/1740154485438283993,現状、所属する吉本興業は否定したうえで抗議。 法的処置を検討と。  ダウンタウン松本人志さん週刊誌報道 吉本興業「当該事実は一切ない」否定 (NHK 2023年12月27日) www3.nhk.or.jp/news/html/2023 …,osi_yo2010,This_Smell,1.0,0.0,1.0,NEUTRAL,0.32041955,0.31708866,0.36249176
2023-12-28 08:35:40+09:00,1740154512458010985,https://x.com/yoshinoma/status/1740154512458010985,1つでも証拠が出てくれば、松本人志引退あるかも？で、トレンドの川口春奈を入れてみるとどれくらいインプレッション稼げるか実験中。,yoshinoma,よしのま,0.0,0.0,1.0,NEUTRAL,0.23545109,0.23663437,0.5279146
2023-12-28 08:35:46+09:00,1740154534176198755,https://x.com/ax64544696/status/1740154534176198755,40年前ライト兄弟時代、横山やすし氏に酷評されたときのふてくされた姿の画像を忘れません。自分らは新しいスタイルと考えているかも知れんけどな…やすし氏の厳しい指摘は続きました。松本人志、浜田雅功の喋りで笑った事は皆無で、人を小ばかにする松本人志の世の中舐めた態度は大嫌いです。,ax64544696,252K.Ushiyama,0.0,4.0,16.0,NEUTRAL,0.23263831,0.23931502,0.52804667
2023-12-28 08:35:51+09:00,1740154558561808673,https://x.com/ck882538/status/1740154558561808673,「こっち！こっち！」自らタクシー停め…「性加害報道」松本人志「一般女性とノリノリ夜遊び」衝撃現場(FRIDAY) ,,,,,,FAVOR,0.345537,0.3600859,0.2943771
2023-12-28 08:35:54+09:00,1740154567604731913,https://x.com/TAKASHI33219319/status/1740154567604731913,松本人志にはホントガッカリだわ。,TAKASHI33219319,Takashi Kimura,0.0,0.0,1.0,NEUTRAL,0.2096094,0.29732007,0.49307054
2023-12-28 08:36:38+09:00,1740154754142273578,https://x.com/azseishiro/status/1740154754142273578,YouTuberになったらバズるやろな  「松本人志のごっつええチャンネル」,azseishiro,せいしろう,0.0,0.0,2.0,AGAINST,0.38381264,0.3287009,0.28748646
2023-12-28 08:36:40+09:00,1740154760878239762,https://x.com/jababjsjejjednw/status/1740154760878239762,松本人志おろすなら徹底的に悪にしてくれんと視聴者納得できんで 普通にテレビで見れんくなるのいやじゃもん 黒白はっきりしようや,jababjsjejjednw,ゆた,0.0,0.0,1.0,NEUTRAL,0.3272166,0.20121178,0.47157165
2023-12-28 08:36:41+09:00,1740154767815700819,https://x.com/uozumi06/status/1740154767815700819,あの芸歴でどっちがくるまかケムリかを松本人志が判別できてる時点で…… ねえ？,uozumi06,魚住,0.0,1.0,3.0,NEUTRAL,0.23399657,0.31014487,0.4558585
2023-12-28 08:36:55+09:00,1740154824942133556,https://x.com/q97860/status/1740154824942133556,芸能界の堕落・・猿之助、宝塚、ジャニーズ・松本人志の性加害問題…芸能界で多くの社会問題が・・ ⇒  ameblo.jp/y05108429z/ent … ,,,,,,NEUTRAL,0.34593815,0.28209737,0.37196445
2023-12-28 08:37:14+09:00,1740154903224590526,https://x.com/yamhos/status/1740154903224590526,私は10年くらい前だったと思う、偶々「懐かしいな」と思って何本か観たら全然笑えなくて。その違和感を抱えた侭、現在進行形の松本人志の番組を観てると根本は余り変わってない気がして、積極的に追うのは止めた。 咄嗟に出るコメントとか、その手の瞬発力は未だに他の追随を許さんと思うけどね。,yamhos,A Clockwork Yamhos,0.0,0.0,0.0,NEUTRAL,0.24608664,0.22507183,0.5288415
2023-12-28 08:37:16+09:00,1740154913945186611,https://x.com/Loneliness_NEET/status/1740154913945186611,松本人志の馬鹿ファンが女が悪いとか松本がそんなことする訳ないとかツイートしてるの見ると、マジで馬鹿で脳みそないんだなって思うわ 昔からこんな奴やで,Loneliness_NEET,田中田,0.0,0.0,1.0,NEUTRAL,0.34513885,0.23971824,0.41514292
2023-12-28 08:37:33+09:00,1740154985726574798,https://x.com/ringochan05221/status/1740154985726574798,松本人志の放送作家吉田定夫（さださん）って何者？まっちゃんとの関係まるわかり記事│気になる  shoko-mag.com/matumoto_houso …,ringochan05221,りか,0.0,0.0,0.0,NEUTRAL,0.26745898,0.32134148,0.4111995
2023-12-28 08:37:39+09:00,1740155008480670053,https://x.com/udon_soba8888/status/1740155008480670053,松本人志の件はさっさと裁判して白黒ハッキリつけてほしい。 疑わしきは罰せず精神だから。,udon_soba8888,麩ーモ,1.0,0.0,0.0,NEUTRAL,0.24336517,0.19315392,0.563481
2023-12-28 08:37:41+09:00,1740155019532661223,https://x.com/H8gCZVeS1FD8y4C/status/1740155019532661223,松本人志さんの問題って8年前とかさ… なんなの週刊誌？ほとんどどうでもいい話じゃん… 今だったらさすがに騒動になるけど8年前って… それはちょっとダメージにも何にもならないっていうか松本人志さんの子どもイジメられたらどうするのさ？ ,,,,,,NEUTRAL,0.344003,0.2843895,0.37160745
2023-12-28 08:37:44+09:00,1740155031222157688,https://x.com/yonko_bu/status/1740155031222157688,松本人志を擁護する人たちすごいな。同じ穴の狢すぎる。松本人志がいなくなったらテレビが終わるんじゃなくて、ああいう奴らを出してるセンスがクソサムすぎて私はテレビ見なくなったわ,yonko_bu,yonko,0.0,0.0,0.0,NEUTRAL,0.3466695,0.24789816,0.40543237
