timestamp,tweet_id,url,content,user_id,user_name,reply_count,retweet_count,like_count,stance_label,stance_against,stance_favor,stance_neutral
2023-12-29 08:59:39+09:00,1740522934513631237,https://x.com/NgztxZrFXG78zQi/status/1740522934513631237,松本人志さんの話題に触れるのをラジオ局やナイツの塙さんが制止するのは良くない メディアによる忖度  ジャニーさんの件、全く反省しとらんじゃねぇか news.yahoo.co.jp/articles/53865 …,NgztxZrFXG78zQi,Ｚ世代の代表,0.0,0.0,0.0,AGAINST,0.44871914,0.23076773,0.3205131
2023-12-29 08:59:41+09:00,1740522943204163822,https://x.com/maruchan_25252/status/1740522943204163822,俺が松ちゃんを叩かないのは、これからも松本人志そしてダウンタウンのお笑いを見ていたいから‼︎  禊は、相席食堂かチャンスの時間でお願いしますww ,,,,,,NEUTRAL,0.31078804,0.2876078,0.4016042
2023-12-29 08:59:47+09:00,1740522968831459419,https://x.com/jackyie/status/1740522968831459419,「松本人志さんから性的被害」の証言報道　吉本興業「法的措置検討」：朝日新聞デジタル  asahi.com/articles/ASRDW … ,,,,,,AGAINST,0.34716696,0.31366336,0.33916965
2023-12-29 08:59:51+09:00,1740522985965166855,https://x.com/sakamotostone/status/1740522985965166855,松本人志さんの騒ぎ、真偽はわからんが、こういう話し出て思う事は、彼だけじゃなくて、男社会において、後輩に女用意させてたらダサいし、後輩もこの人に女用意したら自分のポジションがよくなるって思われてる事がダサい。,sakamotostone,sakatomostone,0.0,0.0,3.0,NEUTRAL,0.2224216,0.23860765,0.53897077
2023-12-29 08:59:55+09:00,1740523002880733342,https://x.com/JkNElMKZ8PMcqt0/status/1740523002880733342,芸人さんがいないと笑えないってのはどうなんだろうなと。松本人志のリプ欄を見てて思っただけです。,JkNElMKZ8PMcqt0,元維新支持者、今、維新お断り！,1.0,1.0,0.0,NEUTRAL,0.20710132,0.25676927,0.5361294
2023-12-30 07:29:42+09:00,1740862685556994477,https://x.com/4AD8RIsTkOgsLKJ/status/1740862685556994477,結局松本人志が本当にヤってたってなったらアホとアホが殴りあってるだけの見世物でしかないんよ 俺はそっちのが面白いからガチでヤってて欲しいけどな お前も芸人なら魅せてみろ松本人志,4AD8RIsTkOgsLKJ,てん,0.0,0.0,0.0,AGAINST,0.4265149,0.28177434,0.2917108
2023-12-30 07:29:57+09:00,1740862748966424985,https://x.com/Pi0a3g1XEI45UtV/status/1740862748966424985,松本人志のスキャンダルどちらかというとイケメン俳優なんかのほうがやってそうだし金持ちの秘密パーティなんかもっと酷いんじゃないとかってに考える。,,,0.0,0.0,0.0,NEUTRAL,0.27192613,0.29856005,0.42951384
2023-12-30 07:29:57+09:00,1740862746172993806,https://x.com/global444111/status/1740862746172993806,８年前のことだから見逃せ？ジャニー喜多川は死んだから許されるみたいな話でしかないと思うな。ダメな行為は証拠を残しておいて絶対告発しろ。８年前っていうとちょうど乙女座は始まりの年（笑）中間結果の年でスキャンダル、見事な流れ。松本人志。,global444111,KATS,0.0,0.0,0.0,NEUTRAL,0.22791396,0.25575355,0.5163325
2023-12-30 07:30:26+09:00,1740862871360426472,https://x.com/c_c_kidd69/status/1740862871360426472,人志松本の酒のツマミになる話 ,,,,,,FAVOR,0.3161737,0.36924255,0.31458375
2023-12-30 07:31:08+09:00,1740863045340205145,https://x.com/tekeishi1/status/1740863045340205145,,,,,,,NEUTRAL,0.2557792,0.31104654,0.43317425
2023-12-30 07:31:15+09:00,1740863074297692338,https://x.com/sakurafujiwara/status/1740863074297692338,文春砲炸裂！松本人志に追撃！《新証言》松本人志と吉本興業への徹底反論。芸能界の異常は何故起きたのか？元博報堂作家本間龍さんと一月万冊  youtu.be/pxMYRjSlnCU?si …  @YouTube より,sakurafujiwara,さくら（小悪魔）,0.0,5.0,8.0,NEUTRAL,0.2367936,0.34935156,0.41385487
2023-12-30 07:31:37+09:00,1740863166874271866,https://x.com/y2CfZ5KmbOxBQCW/status/1740863166874271866,芸人なんていくらでも代えはあるから、松本人志がどうなろうと知らんけど、でも、悪い奴らでないと面白くないよ？,y2CfZ5KmbOxBQCW,ウルトラたけやん,0.0,0.0,0.0,NEUTRAL,0.30759746,0.24026005,0.45214245
2023-12-30 07:31:45+09:00,1740863201934454880,https://x.com/rGuIHylZgtDB7T3/status/1740863201934454880,正義の為にやってるわけねーだろう 俺たちは 松本人志を陥れて 福山を無視しても 仕事は無くならねーし逮捕もされない 自由なんだよ ゼハハハ 痛快だろう 敵に人格否定されようが構わねーよ 敵に筋も通す必要はない ♯おれを交通違反切符取ってなんで あいつをとらないんだ的な,rGuIHylZgtDB7T3,One-Eyed AssasSin,0.0,0.0,0.0,NEUTRAL,0.340165,0.1642034,0.49563158
2023-12-30 07:31:54+09:00,1740863238047408133,https://x.com/blackbird_0525/status/1740863238047408133,時代の波に取り残された奴等は松本人志を支持!時代錯誤も甚だしい。松本人志は消えるべき芸人!,blackbird_0525,ドン・タコス,0.0,0.0,0.0,NEUTRAL,0.31933534,0.30682975,0.37383494
2023-12-30 07:32:00+09:00,1740863263301362051,https://x.com/NgztxZrFXG78zQi/status/1740863263301362051,ホリプロコムよ  「私どもからお話しすることはございません」  ではなく、松本人志さんの疑惑について小沢さんに聞き取り調査をしっかりすべきでは  ,,,,,,NEUTRAL,0.30321872,0.23863132,0.45814994
2023-12-30 07:32:02+09:00,1740863273577468147,https://x.com/touhuwakame/status/1740863273577468147,松本人志の「俺の子を産め」も、本人にとっては軽い冗談だったと思ってる（でも権力者なのでアウト）,touhuwakame,とふとふわかめち,1.0,0.0,1.0,NEUTRAL,0.37736318,0.2326319,0.39000496
2023-12-30 07:32:09+09:00,1740863300353888643,https://x.com/beautif72323550/status/1740863300353888643,アンジャッシュ渡部『脱力タイムズ』で全国地上波復帰　“覆面”登場も正体明かされず　TKOとトリオ漫才で沸かす（オリコン） - Yahoo!ニュース  復帰したんだ。良かった。  ダウンタウン松本人志の 畜生さに比べたら..  佐々木希さんが一番喜んでいる。  ドル円    日経平均  news.yahoo.co.jp/articles/5c586 …,beautif72323550,祇園精舎の鐘の音 beautiful,0.0,0.0,0.0,NEUTRAL,0.23234746,0.30663404,0.4610185
2023-12-30 07:32:41+09:00,1740863436136079716,https://x.com/run_sei_aru_16/status/1740863436136079716,俺は松本人志さんをまだ信じている方だが、 下手に周辺の芸人等が突っ込んだコメントする位なら、やはり松本さん本人がきちんと発信・言及すべきだと思う。 お言葉にはなるが、さすがにあのはぐらかす様な投稿だけでは厳しいかなと思う。,run_sei_aru_16,K-S-R-A,0.0,2.0,4.0,NEUTRAL,0.31924114,0.22799022,0.45276856
2023-12-30 07:33:00+09:00,1740863514053661050,https://x.com/namioimanamio/status/1740863514053661050,今田さんの発言が嘘じゃないとしたら、単に松本人志は人選んでるのでは。  x.com/tenshicos/stat …,namioimanamio,なみお,0.0,0.0,3.0,NEUTRAL,0.3417999,0.27557802,0.38262203
2023-12-30 07:33:01+09:00,1740863521779593416,https://x.com/syunnpuu_m/status/1740863521779593416,テレビ番組「ワイドナショー」で松本人志さんの話題での ,,,,,,NEUTRAL,0.21434198,0.24116533,0.5444928
2023-12-30 07:33:53+09:00,1740863738193010972,https://x.com/sZ7Y6fpPT7bdr1W/status/1740863738193010972,クソ メディアの忖度  松本は視聴者を馬鹿にするのも程がある  アイドル 望月瑠美に セックスを断られ ビンタか  稼いだお金は障害者 にでも 寄付して償う  『ワイドナショー』SP、松本人志の文春報道をトップで取り上げる「扱わないわけにはいかない」（オリコン） ,,,,,,FAVOR,0.36078766,0.37709716,0.26211518
2023-12-30 07:33:58+09:00,1740863759089127823,https://x.com/yukapin/status/1740863759089127823,松本人志＜北野武  これは正しい。でも  松本人志＝世界的VIP  これは違う。  たけしさんは映画監督＆俳優としても 世界的VIPだけど まっちゃんは世界に認められたお笑い芸人 とは言えないから （一部の人にとっては）日本的VIPであっても 世界的VIPではない。,yukapin,ゆかぴん,2.0,4.0,34.0,NEUTRAL,0.2128407,0.22528936,0.5618699
2023-12-30 07:34:02+09:00,1740863774104703478,https://x.com/toshimabou/status/1740863774104703478,ネタも考えずにその場しのぎの思い付きを発言するから、この人の日常が出てしまうのでしょうね。  その逆で「全裸の松本人志がいきなりキスをしてきて。。」と言う文春のツイートはよく考えられています。 これが本当なら逃げ場が無いですから。  ,,,,,,NEUTRAL,0.2942134,0.24167852,0.46410808
2023-12-30 07:34:03+09:00,1740863782006697997,https://x.com/pJJrT1H1AJGTEBX/status/1740863782006697997,吉本の芸人さん使ってるCMは放送停止したほうがいいんじゃないの？松本人志は吉本の代表じゃないかもしれないけど、世間の認識としては似たようなものよね？？プレイヤーとしての吉本興業のトップが松本さんなら、被害者感情を考慮して吉本芸人の起用は避けるべきだよね？,pJJrT1H1AJGTEBX,は,0.0,0.0,3.0,AGAINST,0.3626638,0.27730075,0.3600355
2023-12-30 07:34:36+09:00,1740863918426542574,https://x.com/saitama1972/status/1740863918426542574,バカ左翼｢文春は政権の味方、自民悪事という大事なことを隠す為に松本人志をぶっ込んできた｣  アホか、左翼？文春が自民や政権の味方だったら岸田側近だった木原誠二の嘘スキャダルなんて出さんわ！ 週刊文春は単なる無軌道な偽善守銭奴なだけ！,saitama1972,黒い三連星,0.0,0.0,1.0,NEUTRAL,0.29663894,0.30936384,0.39399725
2023-12-30 07:34:48+09:00,1740863970708512958,https://x.com/SX_67963182/status/1740863970708512958,要約:松本人志はクロ  t.co/WkOPmLY78n,SX_67963182,市井の者,0.0,1.0,7.0,NEUTRAL,0.35960025,0.26108378,0.379316
2023-12-30 07:35:02+09:00,1740864029323915320,https://x.com/4AD8RIsTkOgsLKJ/status/1740864029323915320,俺別に松本人志も面白い奴っちゃな～程度の認識やしな 騒いでる女はそれこそ死のうが生きようがどうでもいい奴な訳で 今回の一件は本当にただの見世物としか思ってないんよ 不愉快じゃない限りは見続けたるけど面白くも無くなったらホントどうでもいいよ,4AD8RIsTkOgsLKJ,てん,0.0,0.0,0.0,NEUTRAL,0.36229834,0.24101292,0.3966888
2023-12-30 07:35:09+09:00,1740864058382078375,https://x.com/1xK1ITujt4mX8c1/status/1740864058382078375,坂本氏「権威に反発しルールがないことはいいことだと言ったのは全共闘世代。今、その世代が親になりそういう子どもを育てた」 その子供が松本人志？  松本人志に坂本龍一さんが生前投げかけていた疑問。90年代にはCDプロデュースしたが／2023人気記事top5  l.smartnews.com/Ld8rF ,,,,,,NEUTRAL,0.26206377,0.20091473,0.5370215
2023-12-30 07:35:18+09:00,1740864094322958611,https://x.com/kazukiSumiyosi/status/1740864094322958611,・週刊文春に中国スパイが記事連載 ・台湾が中国スパイと断定 ・狡猾な共産主義称賛記事 ・批判してるようで持ち上げてる  【台湾政府が認定！なんと週刊文春に中国スパイか！『中国の池上彰と呼ばれる王志安は高級スパイだ！』松本人志どころじゃねーぞ！】 youtu.be/0KKBVlKk__M?si …  @YouTube より,kazukiSumiyosi,和祈澄佳,0.0,0.0,0.0,NEUTRAL,0.2950569,0.33126223,0.3736808
2023-12-30 07:35:33+09:00,1740864155689824615,https://x.com/JcupScottie/status/1740864155689824615,松本人志の件については みんな映画「ホステル」を観たほうがいいよ,JcupScottie,Jcup Scottie,0.0,0.0,0.0,NEUTRAL,0.32878503,0.24669492,0.42452002
2023-12-30 07:35:48+09:00,1740864221834051639,https://x.com/yakedonialoe/status/1740864221834051639,性的暴行の事実があっただろうと思った上で松本人志を擁護してる奴は生まれてくる時代を完全に間違えてるから全員2023年で人生最後にしていいよ。ジャニー擁護してる奴も。,yakedonialoe,トム,0.0,0.0,0.0,NEUTRAL,0.25023726,0.17973223,0.5700305
2023-12-30 07:36:10+09:00,1740864312955334849,https://x.com/sorenandeshow/status/1740864312955334849,どこにも元のツイに松本人志の名前無いのに急に語りだされても  こういう被害者にだけ冷静さの強要するのは自身がレイプ犯罪被害者じゃない上に女性でも無いなら黙っとくべきやと思うよ  下手したらセカンドレイプなり得るから。,sorenandeshow,めちゃん子,1.0,0.0,0.0,NEUTRAL,0.2635917,0.22232376,0.5140845
2023-12-30 07:36:30+09:00,1740864395499155747,https://x.com/gochibochi/status/1740864395499155747,真偽の程がわからんうちに身内が意見言うのはいいけど、この発言はセクハラ認めなかった自衛隊とおんなじこと言うとるで おーるじゃんる : 【悲報】ほんこん、松本人志文春砲に「俺の子を産めとか言うかな？」　女性に「その時何で言えへんねん」「言うとこが違うでしょ？」  crx7601.com/archives/61120 …,gochibochi,ごとうひろひさ／スピリタスおじさん,0.0,0.0,0.0,NEUTRAL,0.3441248,0.24523844,0.41063678
2023-12-30 07:36:45+09:00,1740864459319681191,https://x.com/iR3U22E0Mo77191/status/1740864459319681191,分かってますよ、吉本の株主のフジテレビ。松本人志さんを庇うための番組作りですもの。ならせめてジャニーズのときも慰安婦問題のフェミが作った偽ファン団体PENLIGHTを取材ぜず本物のジャニヲタの意見を聞いてほしかった。告発側だけの話しか聞いてくれまさんでしたね？全局。偏向報道ですもの。,·,@iR3U22E0Mo77191,1.0,0.0,2.0,NEUTRAL,0.2884804,0.21744645,0.4940732
2023-12-30 07:37:00+09:00,1740864524469850179,https://x.com/vNmD43YxsYbGMNb/status/1740864524469850179,ほらねどんどん被害者出てきて，私も、松本人志さんにセクハラされました補助金くださいって，被害者の会できたら、田村さんは、旧ジャニーズ事務所を，叩いたように，同じ言葉で吉本興業及び所属芸人を，叩きますか？あなたの吐いた毒言葉は忘れないからね。,vNmD43YxsYbGMNb,田中敏子,1.0,4.0,57.0,NEUTRAL,0.24606588,0.27980888,0.4741253
2023-12-30 07:37:20+09:00,1740864604539130278,https://x.com/Dr_nomad777/status/1740864604539130278,【悲報】ジャニオタ、何故か松本人志を叩き始めるｗｗｗｗ - わんこーる速報！  onecall2ch.com/archives/10496 …,Dr_nomad777,Dr.ノーマッド,0.0,0.0,0.0,AGAINST,0.3951568,0.2603933,0.34444994
2023-12-30 07:37:30+09:00,1740864647098663226,https://x.com/Iris11Azalea/status/1740864647098663226,あれに対する松本人志の反応が今回の性加害疑惑と同じで返しが(ヤンキー風の)中坊めいてたなあというか,Iris11Azalea,檸檬神社@当方比低浮上,0.0,0.0,1.0,NEUTRAL,0.36057693,0.27121854,0.36820447
2023-12-30 07:37:34+09:00,1740864663829811418,https://x.com/toremis_ug/status/1740864663829811418,これ、「そりゃあセックス込みに決まってるだろ！　女は世間知らず！」路線の人たち、もしも松本が無実だったら、「松本人志世間知らず！　その状況ならせっくすしろ！」路線になるのかな。,toremis_ug,とれみすか,0.0,0.0,0.0,NEUTRAL,0.24918614,0.22941136,0.52140254
2023-12-30 07:37:42+09:00,1740864699900780831,https://x.com/sstcladisk/status/1740864699900780831,松本人志の一件でとことん思ったが、被害者が女になるとこぞって庇おうとするよな。どいつもこいつも  りりちゃんの一件で被害者男性こんなに庇う声なかった気がする,sstcladisk,セロ☆913,0.0,1.0,1.0,NEUTRAL,0.33405212,0.26383054,0.40211737
2023-12-30 07:38:25+09:00,1740864877193986197,https://x.com/chiku012/status/1740864877193986197,松本人志さん、まぁ、個人の好みでは嫌う人も大勢いるけど、一時期のテレビバラエティーを支えるほど魅力あった事実は認めないといけない。 ただ時代がものすごい勢いで流れるから、そうであり続けるのは無理だったってだけで。,chiku012,山中あきら＠おきらく忍伝ハンゾー電子版出てますよ,1.0,1.0,4.0,NEUTRAL,0.26139995,0.20663492,0.53196514
2023-12-30 07:38:28+09:00,1740864890720698797,https://x.com/plum_aquarius/status/1740864890720698797,"人志松本の酒のツマミになる話 #TVer  tver.jp/episodes/epm9q …   椎名林檎さんがのゲスト会に　""照和""の話が出てた　とメモ",plum_aquarius,すもも,0.0,0.0,0.0,NEUTRAL,0.22963773,0.3028317,0.46753055
2023-12-30 07:38:41+09:00,1740864946542694764,https://x.com/JPrakuten_tweet/status/1740864946542694764,松本人志 文春砲にやられるの巻 小沢も。,JPrakuten_tweet,つぶやき☓楽天,0.0,0.0,0.0,NEUTRAL,0.21282077,0.21144044,0.5757388
2023-12-30 07:38:50+09:00,1740864985293795395,https://x.com/KazuRuidoso/status/1740864985293795395,吉本興業のHPでは　当該事実は一切なく　と書かれています。　本当に事実確認したのかが気になります。  淳さんの方から吉本興業が松本人志氏に対して事実確認をしっかりするように働きかけていただきたいです。  万博アンバサダーの立場もありますし、松本氏本人方から早期な記者会見してほしいです。,KazuRuidoso,清水　一慶　Kazu ruidoso,0.0,0.0,6.0,NEUTRAL,0.2505243,0.22800249,0.5214732
2023-12-30 07:38:54+09:00,1740865002561777920,https://x.com/TijJbcYASHE0A9S/status/1740865002561777920,マスコミの「自分達が思ってる方向に誘導する報道」に怒りを覚える!松本人志を庇うなというのではない!何故ジャニーズは燃やし、松ちゃんは庇う? 「何故警察行かない？」「何故今更？」「証言だけじゃなく証拠出せよ」と両方のケースで言うべき ジャニーズ忖度は無くなるが吉本忖度は続く。,TijJbcYASHE0A9S,みきねこさん,0.0,0.0,2.0,NEUTRAL,0.30188236,0.21660887,0.48150882
2023-12-30 07:38:58+09:00,1740865017040572867,https://x.com/forFDL/status/1740865017040572867,松本人志とジャニーさん  いつ？ 松本人志　8年前 ジャニーさん　数十年前  エビデンス 松本人志　証言のみ ジャニーさん　証言のみ  情報源 松本人志　文春 ジャニーさん　文春  これでジャニーズだけぶっ叩いて、松本人志だけ擁護するは分からないw どっちも擁護or叩くのほうがまだ筋通ってると思うw,forFDL,シュロ,0.0,0.0,2.0,NEUTRAL,0.26889887,0.29598913,0.435112
2023-12-30 07:39:49+09:00,1740865230123757598,https://x.com/legacywg5880/status/1740865230123757598,松本人志さん女性スキャンダル、ホリエモン「警察に持ち込んでも事件化されず…」（サカノワ）  u.lin.ee/lJ3PFlU?mediad … 先読み時代　心理戦,legacywg5880,柴,0.0,0.0,0.0,AGAINST,0.377355,0.3145693,0.3080757
2023-12-30 07:39:59+09:00,1740865274801451275,https://x.com/8WWgveiuNNRlIe6/status/1740865274801451275,告発の全てを完全解説!ダウンタウン松本人志に若手芸人が女性を献上する飲み会を文春が暴く!警察動くレベルでヤバ過ぎた…!  youtube.com/watch?v=zigmI6 …,8WWgveiuNNRlIe6,環星榮作,0.0,0.0,0.0,FAVOR,0.33642146,0.38559,0.27798852
2023-12-30 07:40:16+09:00,1740865344791892261,https://x.com/run_sei_aru_16/status/1740865344791892261,あと、ジャニーズファンが「なんでジャニーズだけあんなにやられて松本人志氏は皆忖度するのか」と発言するのも、非常に気持ちは解るのだが、今はまだそういう事は言わない方が良い。  自分さえ良ければとジャニーズを棍棒にしているとも捉えられかねない。,run_sei_aru_16,K-S-R-A,1.0,2.0,4.0,NEUTRAL,0.32873955,0.17885526,0.4924052
2023-12-30 07:40:25+09:00,1740865382733566330,https://x.com/noble_looking/status/1740865382733566330,松本人志性加害の件 文春に目を通したけど吉本側が強気に、ホリプロコム側がぼんやりした言い方になるのわかるな 行為中の内容が良くも悪くも微に入り細に入り書かれている松本に対して 存在感の薄い小沢 8年前の事だからこれくらいのことは言ったかもってなるかもなあ,noble_looking,死に際の貴公子,0.0,0.0,1.0,NEUTRAL,0.30146688,0.25551972,0.44301343
2023-12-30 07:40:38+09:00,1740865435149738433,https://x.com/tqy_nono/status/1740865435149738433,見てる限り、松本人志さんも千鳥も、自分のジャンル外の人からちゃんとした話を聞き出す能力はないし、面白い方に持っていくスキルがあるとは思えなかった。,tqy_nono,T△QUY▲,1.0,0.0,0.0,NEUTRAL,0.26091075,0.36811832,0.37097085
2023-12-30 07:40:40+09:00,1740865443487961178,https://x.com/Su___52/status/1740865443487961178,12月30日(土)仏滅 月徳日  おはようございまスー 今年も残り２日 感謝♡ テヒョンお誕生日おめでとう ,,,,,,NEUTRAL,0.33240297,0.32434916,0.3432479
2023-12-30 07:40:53+09:00,1740865500056596743,https://x.com/8WWgveiuNNRlIe6/status/1740865500056596743,文春砲炸裂！松本人志完全アウトか。吉本興業は全否定。全てのメディアが黙殺する異常事態。安冨歩東大教授。一月万冊  youtube.com/watch?v=7_7CT- …,8WWgveiuNNRlIe6,環星榮作,0.0,0.0,2.0,NEUTRAL,0.32266814,0.3058476,0.37148425
2023-12-30 07:41:17+09:00,1740865601197998474,https://x.com/hitomi_malimi/status/1740865601197998474,松本人志さんのお話し。  私は自分の娘が年頃になった時には  【男の人がいる密室には行くな】  と教えるよ。  旦那には、これをして貰う。笑 短いパンツが可愛い訳じゃないのよ？ 貴女が可愛いのよ？って  怒るばかりじゃ、聞いてくれなくなる。 ユーモアも混ぜたら、自分も楽しいでしょ？,hitomi_malimi,❈𝑯𝒊𝒕𝒐𝒎𝒊☻︎☪︎✬,7.0,10.0,133.0,NEUTRAL,0.23873162,0.26409474,0.49717358
2023-12-30 07:41:32+09:00,1740865661646311690,https://x.com/kageman2000/status/1740865661646311690,茂木健一郎氏、松本人志に皮肉連発　「“天才”というキャラ設定」「軍団が忖度して…」  sirabee.com/2023/12/29/201 …  @sirabee_news より,kageman2000,悪趣ken,0.0,0.0,0.0,NEUTRAL,0.2667759,0.33215353,0.4010705
2023-12-30 07:41:40+09:00,1740865698321293535,https://x.com/saboringmachine/status/1740865698321293535,"「松本人志の会見」に事実認定の基準をおくことに対する異議申し立てであります また、告発を「まったくのデタラメってこともある」と""この段階""で発言すること自体が二次加害となりえることも併せて指摘させていただきますね",saboringmachine,おどろどろ,2.0,1.0,0.0,NEUTRAL,0.30483833,0.31189916,0.38326252
2023-12-30 07:41:44+09:00,1740865713571860825,https://x.com/OpbBrothers/status/1740865713571860825,川崎駅前の繁華街を歩いていたら、おっパブのキャッチが声をかけてきました。 「おっぱいには夢があります！夢を掴みませんか？」  松本 人志さんは、キャッチのおっぱいをモミモミし返して、殴られました。  ,,,,,,NEUTRAL,0.21147309,0.23393957,0.5545873
2023-12-30 07:41:47+09:00,1740865726922268906,https://x.com/SAITOHJIGOKUDOH/status/1740865726922268906,流石に万博（というよりIRのための夢洲整備）と松本人志どっちをとる？　と迫られる事態になったら、後者はあっさり捨てられる。,SAITOHJIGOKUDOH,斉藤地獄堂,1.0,0.0,0.0,NEUTRAL,0.26713058,0.2372001,0.49566936
2023-12-30 07:42:17+09:00,1740865853296693365,https://x.com/oosakahaoosaka/status/1740865853296693365,＞松本人志と吉本興業への徹底反論　参加者A子さんが「馬鹿にされた気分」「心の底から怒り」小沢からの「脅迫」も明かす,oosakahaoosaka,大阪が好きやねん＃カジノのための万博はやめなさい＠維新にこれ以上大阪を壊されてたまるか！,9.0,225.0,441.0,AGAINST,0.372475,0.3020766,0.32544842
2023-12-30 07:42:21+09:00,1740865867024650280,https://x.com/OpbBrothers/status/1740865867024650280,「わたしが風俗街をブラブラと歩いています。皆さんは、おっぱいパブのキャッチになりきって、声をかけてください。」  松本 人志さん「おっぱいぽよーんどうっすか！？」  「おーい、山田くん、座布団１枚もっていって」  ,,,,,,NEUTRAL,0.25894552,0.27808547,0.46296903
2023-12-30 07:42:40+09:00,1740865948775764190,https://x.com/oT0SrQFwIQpwllq/status/1740865948775764190,今、大騒ぎ中の松本人志さんの過去の発言,oT0SrQFwIQpwllq,ルビー・ミッドナイト,0.0,2.0,1.0,NEUTRAL,0.35736945,0.2683466,0.37428397
